Hawaii,21.0943,-157.4983,NA,NA,NA,NA,NA,NA,NA,NA,NA,NA,NA,NA,NA,NA,NA,NA,NA,NA,NA,NA,NA,NA,NA,NA,NA,NA,NA,NA,NA,NA,NA,NA,NA,NA,NA,NA,NA,NA,NA,NA,NA,NA,NA,NA,NA,NA,NA,NA,NA,NA,NA,"The Hawaii Department of Health recommends ' large, crowded gatherings or public events that include 100 people or more be postponed or canceled.'     https://web.archive.org/web/20200716150146/https://health.hawaii.gov/news/corona-virus/covid-19-daily-update-march-13-2020/",NA,NA,NA,"The Hawai‘i Department of Health recommends postponing or canceling in-person events involving 50 or more people for the next eight weeks.     https://web.archive.org/web/20200716161619/https://health.hawaii.gov/news/corona-virus/covid-19-daily-update-march-17-2020/""",NA,NA,NA,NA,NA,NA,NA,NA,NA,NA,NA,NA,NA,NA,NA,NA,NA,NA,NA,NA,NA,NA,NA,NA,NA,NA,NA,NA,NA,NA,NA,NA,NA,NA,NA,NA,NA,NA,NA,NA,NA,NA,NA,NA,NA,NA,NA,NA,NA,NA,NA,NA,NA,NA,NA,NA,NA,NA,NA,NA,NA,NA,NA,NA,NA,NA,NA,NA,NA,NA,NA,NA,NA,NA,NA,NA,NA,NA,NA,NA,NA,NA,NA,NA,NA,NA,NA,NA,NA,NA,NA,NA,NA,NA,NA,NA,NA,NA,NA,NA,NA,NA,NA,NA,NA,NA,NA,NA,NA,NA,NA,NA,NA,NA,NA,NA,NA,NA,NA,NA,NA,"Based on the proclamation, the indicator is changed to 2G to reflect the following notes:   1. Large gatherings are restricted on the island.   2. Large venues and clubs are listed as 'to be closed' under Exhibit F of the proclamation.     We infer that public events therefore are not allowed until the measures are further relaxed.     https://web.archive.org/web/20200720210532/https://governor.hawaii.gov/wp-content/uploads/2020/07/2007090-ATG_Tenth-Supplementary-Proclamation-for-COVID-19-distribution-signed.pdf",NA,NA,NA,NA,NA,NA,NA,NA,NA,NA,NA,NA,NA,NA,NA,NA,NA,NA,NA,NA,NA,NA,NA,NA,NA,NA,NA,NA,NA,NA,NA,NA,NA,NA,NA,NA,NA,NA,NA,NA,NA,NA,NA,NA,NA,NA,NA,NA,NA,NA,NA,NA,NA,NA,NA,NA,NA,NA,NA,NA,NA,NA,NA,NA,NA,NA,NA,NA,NA,NA,NA,NA,NA,NA,NA,NA,NA,NA
Idaho,44.2405,-114.4788,NA,NA,NA,NA,NA,NA,NA,NA,NA,NA,NA,NA,NA,NA,NA,NA,NA,NA,NA,NA,NA,NA,NA,NA,NA,NA,NA,NA,NA,NA,NA,NA,NA,NA,NA,NA,NA,NA,NA,NA,NA,NA,NA,NA,NA,NA,NA,NA,NA,NA,NA,NA,NA,NA,NA,NA,NA,NA,NA,NA,NA,NA,NA,"Order does not explicitly cancel public events, but non-essential gatherings of any number outside of the family unit are prohibited. Archive version:  http://archive.fo/E52Ir  https://coronavirus.idaho.gov/wp-content/uploads/2020/06/statewide-stay-home-order_032520.pdf",NA,NA,NA,NA,NA,NA,NA,NA,NA,NA,NA,NA,NA,NA,NA,NA,NA,NA,NA,NA,"On 15 April, governor extended the 25 March Stay at Home order until April 30.  https://web.archive.org/web/20200711150941/https://coronavirus.idaho.gov/wp-content/uploads/2020/06/amended-statewide-stay-home-order_041520.pdf",NA,NA,NA,NA,NA,NA,NA,NA,NA,NA,NA,NA,NA,NA,NA,"The 1 May Stay Healthy order stated:  ""Gatherings both public and private are discouraged.""  https://web.archive.org/web/20200711153428/https://coronavirus.idaho.gov/wp-content/uploads/2020/06/stay-healthy-order-stage1.pdf",NA,NA,NA,NA,NA,NA,NA,NA,NA,NA,NA,NA,NA,NA,No gatherings greater than 10 people allowed.  https://web.archive.org/save/https://coronavirus.idaho.gov/wp-content/uploads/2020/06/stay-healthy-order-stage2.pdf,NA,NA,NA,NA,NA,NA,NA,NA,NA,NA,NA,NA,NA,30 May Stay Healthy Phase 3 allows gatherings of up to 50 people so public events can occur up to 50 people if adequate physical distancing and sanitation recommendations are followed.  http://archive.fo/ZOL4Q,NA,NA,NA,NA,NA,NA,NA,NA,NA,NA,NA,NA,NA,"13 June Stay Healthy order Phase 4 removes any limit on gathering size although it does require adherence to  relevant ""Physical Distancing and Sanitation recommendations.""    https://web.archive.org/web/20200715220533/https://rebound.idaho.gov/stage-4-stay-healthy-guidelines/",NA,NA,NA,NA,NA,NA,NA,NA,NA,NA,"Effective 24 June, Ada county home to two largest cities in Idaho (Boise and Meridian) reverted back to phase 3, limiting size of gatherings to 50 people or less.  http://archive.fo/8FF4w",NA,NA,NA,NA,NA,NA,NA,NA,NA,NA,NA,NA,NA,NA,NA,NA,NA,NA,NA,NA,NA,NA,NA,NA,NA,NA,NA,NA,NA,NA,NA,NA,NA,NA,NA,NA,NA,NA,NA,NA,NA,NA,NA,NA,NA,NA,NA,NA,NA,NA,NA,NA,NA,NA,NA,NA,NA,NA,NA,NA,NA,NA,NA,NA,NA,NA,NA,NA,NA,NA,NA,NA,NA,NA,NA,NA,NA,NA,NA,NA,NA,NA,NA,NA,NA,NA,NA,NA,NA,NA,NA,NA,NA,NA,NA,NA,NA,NA,NA,NA,NA
Illinois,40.3495,-88.9861,NA,NA,NA,NA,NA,NA,NA,NA,NA,NA,NA,NA,NA,NA,NA,NA,NA,NA,NA,NA,NA,NA,NA,NA,NA,NA,NA,NA,NA,NA,NA,NA,NA,NA,NA,NA,NA,NA,NA,NA,NA,NA,NA,NA,NA,NA,NA,NA,NA,NA,NA,Public events of more than 1000 people are required to be cancelled.   http://archive.vn/v5glR,NA,NA,NA,NA,"From 18 march, public gatherings and events of more than 50 people are prohibited  http://archive.vn/wip/xJnvg",NA,NA,All public events to be cancelled.   http://archive.vn/YBkdo,NA,NA,NA,NA,NA,NA,NA,NA,NA,NA,orders extended until April 30  http://archive.vn/Y4aTi,NA,NA,NA,NA,NA,NA,NA,NA,NA,NA,NA,NA,NA,NA,NA,NA,NA,NA,NA,NA,NA,NA,NA,NA,NA,NA,NA,NA,NA,Public events remained cancelled or suspended   http://archive.vn/xuFkT,NA,NA,NA,NA,NA,NA,NA,NA,NA,NA,NA,NA,NA,NA,NA,NA,NA,NA,NA,NA,NA,NA,NA,NA,NA,NA,NA,"On 29 May, Illinois Governor JB Pritzker released Executive Order 2020-39 which reissued EO 2020-32 which states, “All public and private gatherings of any number of people occurring outside a single household or living unit are prohibited, except for the limited purposes permitted by this Executive Order.”  EO 2020-39 is “extended through June 27, 2020 or until corresponding legislation is enacted and takes effect, whichever occurs first.”   https://web.archive.org/web/20200719195651/https://www2.illinois.gov/Pages/Executive-Orders/ExecutiveOrder2020-39.aspx     EO 2020-32: http://archive.vn/xuFkT#selection-1015.0-1015.195",NA,NA,NA,NA,NA,NA,NA,NA,NA,NA,NA,NA,NA,NA,NA,NA,NA,NA,NA,NA,NA,NA,NA,NA,NA,NA,NA,"On 26 June, Illinois Governor JB Pritzker allowed meetings and events to operate with fewer than fifty attendees or fifty percent room capacity. Amusement parks, arcades, bowling alleys, zoos, theaters, etc are opened under public health guidelines.    https://web.archive.org/web/20200721161846/https://www2.illinois.gov/Pages/Executive-Orders/ExecutiveOrder2020-43.aspx",NA,NA,NA,NA,NA,NA,NA,NA,NA,NA,NA,NA,NA,NA,NA,NA,NA,NA,NA,NA,NA,NA,NA,NA,NA,NA,NA,"On 24 July, Illinois Governor JB Pritzker extended the former Executive Order which allowed meetings and events to operate with fewer than fifty attendees or fifty percent room capacity. Amusement parks, arcades, bowling alleys, zoos, theaters, etc are opened under public health guidelines. (Likely until 22 August, as that’s when the second Executive Order also released 24 July is extended to.)     Executive Order 48: https://web.archive.org/web/20200726214044/https://www2.illinois.gov/Pages/Executive-Orders/ExecutiveOrder2020-48.aspx",NA,NA,NA,NA,NA,NA,NA,NA,NA,NA,NA,NA,NA,NA,NA,NA,NA,NA,NA,NA,NA,NA,NA,NA,NA,NA,NA,"On 21 August, in Executive Order 2020-52, the Governor reissued most executive orders, extending a majority of the provisions through September 19, 2020.    This includes the previous orders allowing meetings and events to operate with fewer than fifty attendees or fifty percent room capacity. Amusement parks, arcades, bowling alleys, zoos, theaters, etc are opened under public health guidelines.     https://web.archive.org/web/20200825204032/https://www2.illinois.gov/Pages/Executive-Orders/ExecutiveOrder2020-52.aspx",NA,NA,NA,NA,NA,NA,NA,NA,NA,NA,NA,NA,NA,NA,NA,NA,NA,NA,NA,NA,NA,NA,NA,NA,NA,NA,NA,"On 18 September, in Executive Order 2020-55, the Governor reissued most executive orders, extending a majority of the provisions through 17 October 2020.     This includes the previous orders allowing meetings and events to operate with fewer than fifty attendees or fifty percent room capacity. Amusement parks, arcades, bowling alleys, zoos, theaters, etc are opened under public health guidelines.    https://web.archive.org/web/20200922144918/https://www2.illinois.gov/Pages/Executive-Orders/ExecutiveOrder2020-55.aspx",NA,NA,NA,NA,NA,NA,NA,NA,NA,NA,NA,NA,NA,NA,NA
Indiana,39.8494,-86.2583,NA,NA,NA,NA,NA,NA,NA,NA,NA,NA,NA,NA,NA,NA,NA,NA,NA,NA,NA,NA,NA,NA,NA,NA,NA,NA,NA,NA,NA,NA,NA,NA,NA,NA,NA,NA,NA,NA,NA,NA,NA,NA,NA,NA,NA,NA,NA,NA,NA,NA,NA,NA,NA,NA,"On 16 March and with Governor Eric Holcomb's executive order on the same day limiting gatherings to 50, the Indiana State Fair Commission suspends all events for 8 weeks.    See announcement under 16 March:  http://web.archive.org/web/20200716004456/https://www.indianastatefair.com/p/events/covid-19",NA,NA,NA,NA,NA,NA,NA,NA,"Effective March 25, Governor Eric Holcomb directs via Executive Order 20-08 all places of public amusement to close, including fairs, carnivals, concert music halls, and zoos. In addition, he has ordered all individuals to stay home except for essential activities, and limited all gatherings to 10. It can be inferred that all public events are cancelled.    See Executive Order 20-08:  http://web.archive.org/web/20200713164805/https://www.in.gov/gov/files/Executive_Order_20-08_Stay_at_Home.pdf",NA,NA,NA,NA,NA,NA,NA,NA,NA,NA,NA,NA,NA,NA,NA,NA,NA,NA,NA,NA,NA,NA,NA,NA,NA,NA,NA,NA,NA,NA,NA,NA,NA,NA,NA,NA,"With Governor Eric Holcomb's roadmap for Indiana's reopening, the State Fair Commission extends the suspension of all events through the end of June, hoping for a reopening of events at full capacity by the 4 July. In addition, on 12 June, the State Government released a document saying that all conventions, parades, fairs, and similar events ""remain"" closed, hence public events are cancelled at least until that date.    See announcement under May 1:  http://web.archive.org/web/20200716004456/https://www.indianastatefair.com/p/events/covid-19    See document by the State Government:  http://web.archive.org/web/20200716010143/https://backontrack.in.gov/files/BackOnTrack-IN_WhatsOpen-Closed-stage4.pdf",NA,NA,NA,NA,NA,NA,NA,NA,NA,NA,NA,NA,NA,NA,NA,NA,NA,NA,NA,NA,NA,NA,NA,NA,NA,NA,NA,NA,NA,NA,NA,NA,NA,NA,NA,NA,NA,NA,NA,NA,NA,"On 12 June, all counties move to Stage 4 of Governor Eric Holcomb's ""Back on Track"" plan. Gatherings are limited to 250 people. Conventions, parades, fairs, and similar events remain closed.    See document by the State Government:  http://web.archive.org/web/20200716010143/https://backontrack.in.gov/files/BackOnTrack-IN_WhatsOpen-Closed-stage4.pdf",NA,NA,NA,NA,NA,NA,NA,NA,NA,NA,NA,NA,NA,NA,NA,NA,NA,NA,NA,NA,NA,"On 4 July, all counties except Elkhart County will move to Stage 4.5 of Governor Eric Holcomb's ""Back on Track"" plan. Except in Elkhart County, all conventions resume, with requirements for 6ft social distancing and a limit of 250 people (see Executive Order 20-35). Elkhart County shall remain on Stage 4 (with conventions and fairs closed) until at least 17 July, as indicated by Executive Order 20-35.    See document on Stage 4.5 by the State Government:  http://web.archive.org/web/20200716013117/https://backontrack.in.gov/files/Stage_4.5.pdf    See Executive Order 20-35:  http://web.archive.org/web/20200716030547/https://www.in.gov/gov/files/Executive%20Order%2020-35%20Back%20on%20Track%20Indiana%20Stage%204_5.pdf",NA,NA,NA,NA,NA,NA,NA,NA,NA,NA,NA,NA,NA,NA,NA,NA,NA,NA,"Executive Order 20-36, signed by Governor Eric Holcombe, allows for ""Special or Seasonal Events"" from 23 July, including for Elkhart County. These encompass festivals, fairs, parades, graduations, etc (distinct from ""Meetings"" or ""Gatherings"" where the objective is purely to interact with others). Unlike gatherings, events can hold more than 250 people, but must be vetted by the local health department to outline capacity limits, sanitation, social distancing measures, etc.     See Executive Order 20-36:  http://web.archive.org/web/20200719150930/https://www.in.gov/gov/files/Executive%20Order%2020-36%20(Continuation%20Stage%204.5).pdf",NA,NA,NA,NA,NA,NA,"On July 30th, Governor Eric Holcomb issued an executive order 20-39, which extended his previous recommendation on the cancellation of public events until August 27, 2020. Events with more than 250 attendees must obtain approval from health officials.     http://web.archive.org/web/20200802070251/https://www.in.gov/gov/files/Executive%20Order%2020-39%20%282nd%20Extension%20Stage%204.5%29.pdf",NA,NA,NA,NA,NA,NA,NA,NA,NA,NA,NA,NA,NA,NA,NA,NA,NA,NA,NA,NA,NA,NA,NA,NA,NA,NA,NA,NA,NA,NA,NA,NA,NA,NA,NA,NA,NA,NA,NA,NA,NA,NA,NA,NA,NA,NA,NA,NA,NA,NA,NA,NA,NA,NA,NA,NA,NA,NA,NA,NA,NA,NA,NA,NA,NA
Iowa,42.0115,-93.2105,NA,NA,NA,NA,NA,NA,NA,NA,NA,NA,NA,NA,NA,NA,NA,NA,NA,NA,NA,NA,NA,NA,NA,NA,NA,NA,NA,NA,NA,NA,NA,NA,NA,NA,NA,NA,NA,NA,NA,NA,NA,NA,NA,NA,NA,NA,NA,NA,NA,NA,NA,NA,NA,NA,NA,Iowa Governor Kim Reynolds ordered large gatherings and events to be postponed or cancelled.    https://web.archive.org/web/20200722204757/https://governor.iowa.gov/sites/default/files/documents/Public%20Health%20Proclamation%20-%202020.03.17.pdf,NA,NA,NA,NA,NA,NA,NA,NA,NA,NA,NA,NA,NA,NA,NA,"On April 2nd, Iowa Governor Kim Reynolds extended the closure of businesses, restrictions on mass gatherings, and cancellation of public events until April 30th.    http://web.archive.org/web/20200726114623/https://governor.iowa.gov/sites/default/files/documents/Public%20Health%20Disaster%20Proclamation%20-%202020.04.02.pdf",NA,NA,NA,NA,NA,NA,NA,NA,NA,NA,NA,NA,NA,NA,NA,NA,NA,NA,NA,NA,NA,NA,NA,NA,NA,NA,NA,NA,Iowa Governor Kim Reynolds issued a proclamation that extended the cancellation of public events and restrictions on mass gatherings until May 15th.    http://web.archive.org/web/20200727082951/https://governor.iowa.gov/sites/default/files/documents/Public%20Health%20Proclamation%20-%202020.04.27%20-%20Pt%201.pdf,NA,NA,NA,NA,NA,NA,NA,NA,NA,NA,NA,"On May 13th, Iowa Governor Kim Reynolds ordered the extension of reopening of certain businesses, cancellation of public events, and restrictions on mass gatherings until May 27th.    http://web.archive.org/web/20200727100425/https://governor.iowa.gov/sites/default/files/documents/Public%20Health%20Proclamation%20-%202020.05.13.pdf",NA,NA,NA,NA,NA,NA,NA,NA,NA,NA,NA,NA,Iowa Governor Kim Reynolds issued a proclamation that extended the cancellation of public events and restrictions on mass gatherings until May 31st.     http://web.archive.org/web/20200727105310/https://governor.iowa.gov/sites/default/files/documents/Public%20Health%20Proclamation%20-%202020.05.26%20%281%29.pdf,NA,NA,NA,NA,NA,Mass gatherings and events of more than 10 people are allowed if (1) their capacity is limited to 50% of their venue capacity; (2) social distancing rule is applied; and (3) other Iowa Department of Public Health's measures are followed.   http://web.archive.org/web/20200621043026/https://governor.iowa.gov/sites/default/files/documents/Public%20Health%20Proclamation%20-%202020.05.26%20%281%29.pdf,NA,NA,NA,NA,NA,NA,NA,NA,NA,NA,NA,NA,NA,NA,NA,NA,NA,NA,NA,NA,NA,NA,NA,NA,NA,NA,NA,NA,NA,NA,NA,NA,NA,NA,NA,NA,NA,NA,NA,NA,NA,NA,NA,NA,NA,NA,NA,NA,NA,NA,NA,NA,NA,NA,NA,NA,NA,NA,NA,NA,NA,NA,NA,NA,NA,NA,NA,NA,NA,NA,NA,NA,NA,NA,NA,NA,NA,NA,NA,NA,"Through a new proclamation on August 21st, Iowa Governor Kim Reynolds continued to allow mass gatherings and events as long as participants were six feet apart from each other. Sporting and religious events were exempted from the six feet social distancing rule, but organizers must implement reasonable social distancing and public health measures.     http://web.archive.org/save/https://governor.iowa.gov/sites/default/files/documents/Public%20Health%20Proclamation%20-%202020.08.21_0.pdf",NA,NA,NA,NA,NA,NA,NA,NA,NA,NA,NA,NA,NA,NA,NA,NA,NA,NA,NA,NA,NA,NA,NA,NA,NA,NA,NA,"On September 18th, Iowa Governor Kim Reynolds continued to permit public events and gatherings to take place. Event organizers must implement social distancing measures and follow health guidance issued by the Iowa Department of Public Health.     http://web.archive.org/web/20200924080329/https://governor.iowa.gov/sites/default/files/documents/Public%20Health%20Disaster%20Proclamation%20-%202020.09.18.pdf",NA,NA,NA,NA,NA,NA,NA,NA,NA,NA,NA,NA,NA,NA,NA
Kansas,38.5266,-96.7265,NA,NA,NA,NA,NA,NA,NA,NA,NA,NA,NA,NA,NA,NA,NA,NA,NA,NA,NA,NA,NA,NA,NA,NA,NA,NA,NA,NA,NA,NA,NA,NA,NA,NA,NA,NA,NA,NA,NA,NA,NA,NA,NA,NA,NA,NA,NA,NA,NA,NA,NA,NA,NA,NA,NA,NA,NA,NA,NA,NA,NA,NA,NA,NA,NA,NA,NA,NA,Non-essential events are cancelled as a part of Governor Kelly's stay at home order.    https://web.archive.org/web/20200701181532/https://governor.kansas.gov/wp-content/uploads/2020/03/EO20-16.pdf,NA,NA,NA,NA,NA,NA,NA,NA,NA,NA,NA,NA,NA,NA,NA,NA,NA,NA,NA,NA,NA,NA,NA,NA,NA,NA,NA,NA,NA,NA,NA,NA,NA,NA,NA,NA,NA,NA,NA,NA,NA,NA,NA,NA,NA,NA,NA,NA,NA,NA,NA,NA,NA,NA,NA,NA,NA,NA,NA,NA,NA,NA,NA,NA,NA,NA,NA,NA,NA,Phase 3 of Ad Astra (Kansas' reopening plan) allows all venues to resume operation provided they follow social distancing guidelines.    https://web.archive.org/web/20200630103741/https://knss.radio.com/articles/governor-kelly-recommends-kansas-move-into-phase-3,NA,NA,NA,NA,NA,NA,NA,NA,NA,NA,NA,NA,NA,NA,NA,NA,NA,NA,NA,NA,NA,NA,NA,NA,NA,NA,NA,NA,NA,NA,NA,NA,NA,NA,NA,NA,NA,NA,NA,NA,NA,NA,NA,NA,NA,NA,NA,NA,NA,NA,NA,NA,NA,NA,NA,NA,NA,NA,NA,NA,NA,NA,NA,NA,NA,NA,NA,NA,NA,NA,NA,NA,NA,NA,NA,NA,NA,NA,NA,NA,NA,NA,NA,NA,NA,NA,NA,NA,NA,NA,NA,NA,NA,NA,NA,NA,NA,NA,NA,NA,NA,NA,NA,NA,NA,NA,NA,NA,NA,NA,NA,NA,NA,NA,NA,NA,NA
Kentucky,37.6681,-84.6701,NA,NA,NA,NA,NA,NA,NA,NA,NA,NA,NA,NA,NA,NA,NA,NA,NA,NA,NA,NA,NA,NA,NA,NA,NA,NA,NA,NA,NA,NA,NA,NA,NA,NA,NA,NA,NA,NA,NA,NA,NA,NA,NA,NA,NA,NA,NA,NA,NA,11th March  ?Advised that all community gatherings should be cancelled or postponed.  Kentucky Governor Andy Beshear declared a state of emergency on March 6  https://web.archive.org/web/20200616114144/https://governor.ky.gov/covid-19,"On 12 March, the Louisville city government ""ordered all events hosted or permitted by Louisville Metro Government or held in a Louisville Metro facility will be postponed or cancelled, and recommended that all other events in the city also be postponed or cancelled as well.""     See the calendar of responses:  http://web.archive.org/web/20200330184246/https://louisvilleky.gov/government/louisville-covid-19-response-timeline",NA,NA,NA,NA,NA,NA,"19th March  ?Issued a formal letter banning all mass gatherings. The measure states what Gov. Beshear has previously recommended, including:  Mass gatherings include any event or convening that brings together groups of individuals, including, but not limited to, community, civic, public, leisure, faith-based or sporting events; parades; concerts; festivals; conventions; fundraisers; and similar activities.  Kentucky Governor Andy Beshear declared a state of emergency on March 6  https://web.archive.org/web/20200616114144/https://governor.ky.gov/covid-19",NA,NA,NA,NA,NA,NA,NA,NA,NA,NA,NA,NA,NA,NA,NA,NA,NA,NA,NA,NA,NA,NA,NA,NA,NA,NA,NA,NA,NA,NA,NA,NA,NA,NA,NA,NA,NA,NA,NA,NA,NA,NA,NA,NA,NA,NA,NA,NA,NA,NA,NA,NA,NA,NA,NA,NA,NA,NA,NA,NA,NA,NA,NA,NA,NA,NA,NA,NA,NA,NA,NA,NA,NA,NA,NA,NA,NA,NA,"6th June  Announced churches, synagogues, mosques and other houses of worship can begin hosting congregants at 50% of their pre-pandemic capacities. Still no mention of allowing mass public gatherings, and gatherings up to 50 people not yet allowed so remains coded as a 2.  https://web.archive.org/web/20200616114144/https://governor.ky.gov/covid-19",7th June  Phase 3 is coming July 1 with bars (with limitations) and gatherings up to 50 people allowed. This suggests that as of 7th June this is still prohibited.  Kentucky Governor Andy Beshear declared a state of emergency on March 6  https://web.archive.org/web/20200616114144/https://governor.ky.gov/covid-19,NA,NA,NA,NA,NA,NA,NA,NA,NA,NA,NA,NA,NA,NA,NA,NA,NA,NA,NA,NA,NA,"As of June 29, public venues and event spaces may open but they must limit the persons in these spaces to 50% of the maximum permitted occupancy capacity. All safety precautions must be planned for and encouraged among attendees,   According to Governor Beshear: “Next Monday {29th June}, just about everything in the commonwealth will be open, from bars, wedding venues, public pools and even Kentucky Kingdom,”   *The orders for mass gatherings are not applicable to public spaces.  http://archive.vn/9mPD1",NA,NA,NA,NA,NA,NA,NA,NA,NA,NA,NA,NA,NA,NA,NA,NA,NA,NA,NA,NA,NA,NA,NA,NA,NA,NA,NA,NA,NA,NA,NA,NA,NA,NA,NA,NA,NA,NA,NA,NA,NA,NA,NA,NA,NA,NA,NA,NA,NA,NA,NA,NA,NA,NA,NA,NA,NA,NA,NA,NA,NA,NA,NA,NA,NA,NA,NA,NA,NA,NA,NA,NA,NA,NA,NA,NA,NA,NA,NA,NA,NA,NA,NA,NA,NA,NA,NA,NA,NA,NA,NA,NA,NA,NA,NA,NA
