State,Lat,Long_,2020-01-22,2020-01-23,2020-01-24,2020-01-25,2020-01-26,2020-01-27,2020-01-28,2020-01-29,2020-01-30,2020-01-31,2020-02-01,2020-02-02,2020-02-03,2020-02-04,2020-02-05,2020-02-06,2020-02-07,2020-02-08,2020-02-09,2020-02-10,2020-02-11,2020-02-12,2020-02-13,2020-02-14,2020-02-15,2020-02-16,2020-02-17,2020-02-18,2020-02-19,2020-02-20,2020-02-21,2020-02-22,2020-02-23,2020-02-24,2020-02-25,2020-02-26,2020-02-27,2020-02-28,2020-02-29,2020-03-01,2020-03-02,2020-03-03,2020-03-04,2020-03-05,2020-03-06,2020-03-07,2020-03-08,2020-03-09,2020-03-10,2020-03-11,2020-03-12,2020-03-13,2020-03-14,2020-03-15,2020-03-16,2020-03-17,2020-03-18,2020-03-19,2020-03-20,2020-03-21,2020-03-22,2020-03-23,2020-03-24,2020-03-25,2020-03-26,2020-03-27,2020-03-28,2020-03-29,2020-03-30,2020-03-31,2020-04-01,2020-04-02,2020-04-03,2020-04-04,2020-04-05,2020-04-06,2020-04-07,2020-04-08,2020-04-09,2020-04-10,2020-04-11,2020-04-12,2020-04-13,2020-04-14,2020-04-15,2020-04-16,2020-04-17,2020-04-18,2020-04-19,2020-04-20,2020-04-21,2020-04-22,2020-04-23,2020-04-24,2020-04-25,2020-04-26,2020-04-27,2020-04-28,2020-04-29,2020-04-30,2020-05-01,2020-05-02,2020-05-03,2020-05-04,2020-05-05,2020-05-06,2020-05-07,2020-05-08,2020-05-09,2020-05-10,2020-05-11,2020-05-12,2020-05-13,2020-05-14,2020-05-15,2020-05-16,2020-05-17,2020-05-18,2020-05-19,2020-05-20,2020-05-21,2020-05-22,2020-05-23,2020-05-24,2020-05-25,2020-05-26,2020-05-27,2020-05-28,2020-05-29,2020-05-30,2020-05-31,2020-06-01,2020-06-02,2020-06-03,2020-06-04,2020-06-05,2020-06-06,2020-06-07,2020-06-08,2020-06-09,2020-06-10,2020-06-11,2020-06-12,2020-06-13,2020-06-14,2020-06-15,2020-06-16,2020-06-17,2020-06-18,2020-06-19,2020-06-20,2020-06-21,2020-06-22,2020-06-23,2020-06-24,2020-06-25,2020-06-26,2020-06-27,2020-06-28,2020-06-29,2020-06-30,2020-07-01,2020-07-02,2020-07-03,2020-07-04,2020-07-05,2020-07-06,2020-07-07,2020-07-08,2020-07-09,2020-07-10,2020-07-11,2020-07-12,2020-07-13,2020-07-14,2020-07-15,2020-07-16,2020-07-17,2020-07-18,2020-07-19,2020-07-20,2020-07-21,2020-07-22,2020-07-23,2020-07-24,2020-07-25,2020-07-26,2020-07-27,2020-07-28,2020-07-29,2020-07-30,2020-07-31,2020-08-01,2020-08-02,2020-08-03,2020-08-04,2020-08-05,2020-08-06,2020-08-07,2020-08-08,2020-08-09,2020-08-10,2020-08-11,2020-08-12,2020-08-13,2020-08-14,2020-08-15,2020-08-16,2020-08-17,2020-08-18,2020-08-19,2020-08-20,2020-08-21,2020-08-22,2020-08-23,2020-08-24,2020-08-25,2020-08-26,2020-08-27,2020-08-28,2020-08-29,2020-08-30,2020-08-31,2020-09-01,2020-09-02,2020-09-03,2020-09-04,2020-09-05,2020-09-06,2020-09-07,2020-09-08,2020-09-09,2020-09-10,2020-09-11,2020-09-12,2020-09-13,2020-09-14,2020-09-15,2020-09-16,2020-09-17,2020-09-18,2020-09-19,2020-09-20,2020-09-21,2020-09-22,2020-09-23,2020-09-24,2020-09-25,2020-09-26,2020-09-27,2020-09-28,2020-09-29,2020-09-30,2020-10-01,2020-10-02,2020-10-03
Alabama,32.3182,-86.9023,NA,NA,NA,NA,NA,NA,NA,NA,NA,NA,NA,NA,NA,NA,NA,NA,NA,NA,NA,NA,NA,NA,NA,NA,NA,NA,NA,NA,NA,NA,NA,NA,NA,NA,NA,NA,NA,NA,NA,NA,NA,NA,NA,NA,NA,NA,NA,NA,NA,NA,NA,"On March 13, the Jefferson County Department of Health and the City of Birmingham recommended that large public events of over 500 people be cancelled due to COVID-19. Smaller events and venues were encouraged to follow social distancing and sanitation guidelines.    https://web.archive.org/web/20200513152740/https://www.birminghamal.gov/2020/03/12/coronavirus-threat-prompts-cancellation-of-several-march-events/",NA,NA,"On March 16, the Alabama Department of Public Health issued recommendations regarding public gatherings and events, including the recommendation that there should be no gatherings of more than 50 people or any events where social distancing couldn’t be maintained. This can be interpreted as a de facto recommendation for the cancellation of public events.    https://web.archive.org/web/20200721190037/https://alabamapublichealth.gov/news/2020/03/16.html     The Mayor of Birmingham also issued a recommendation that there be no gatherings of 25 or more people, which is here interpreted as a de facto recommendation for the cancellation of public events.    https://web.archive.org/web/20200721190531/https://www.birminghamal.gov/2020/03/16/mayor-randall-l-woodfin-calls-state-of-emergency-for-city-of-birmingham-due-to-coronavirus-threat/","On March 17, the order of the Jefferson County Health Officer prohibiting all gatherings of 25 or more people, and all gatherings of any size where social distancing cannot be maintained, in effect cancelling all public events. This order included “community, civic, public, leisure, exercise, faith-based, and sporting events with spectators, concerts, conventions, fundraisers, parades, fairs, festivals, or any similar event or activity.” Jefferson County is the home of Birmingham, the state’s most populous city.    https://web.archive.org/web/20200322102136/https://www.alabamapublichealth.gov/legal/assets/order-jchd-gatherings-031720.pdf	    The State Health Officer issued an order for Blount, Saint Clair, Shelby, Tuscaloosa, and Walker Counties prohibiting all gatherings of 25 people or more, as well as any gathering during which social distancing (a six-foot distance between individuals) is impossible to maintain on the same day. This prohibition applied to all gatherings, events, or activities with more than 25 people in a single space at a single time. This is interpreted here as a de facto prohibition against public events. Exemptions to this order were to be requested in writing at least 2 weeks in advance of the suspended event.     https://web.archive.org/web/20200715232233/https://www.alabamapublichealth.gov/legal/assets/order-adph-cov-gatherings-031720.pdf",NA,"On March 19, the State Health Officer issued an order expanding the prohibition of events and gatherings with more than 25 people statewide. Gatherings where social distancing could not be maintained were also banned.    https://web.archive.org/web/20200612013152/http://www.alabamapublichealth.gov/legal/assets/order-adph-cov-gatherings-031920.pdf","On March 20, the Governor and the State Health Officer amended the statewide order of March 19 to clarify that the gatherings and events prohibited were specifically non-work events.   https://web.archive.org/web/20200721192813/https://governor.alabama.gov/newsroom/2020/03/governor-ivey-issues-statement-on-updated-statewide-public-health-order/    https://web.archive.org/web/20200721193500/https://alabamapublichealth.gov/legal/assets/order-publicgathering-032020.pdf",NA,NA,NA,"On March 24, the City of Birmingham instituted a “shelter in place” ordinance that prohibited public events and gatherings of more than 10 people, or gatherings of any size where social distancing could not be maintained. The order was initially in effect through April 3, but was later extended through April 30.    https://web.archive.org/web/20200721193641/https://www.birminghamal.gov/2020/03/24/birmingham-city-council-approves-shelter-in-place-ordinance-to-slow-covid-19/    https://web.archive.org/web/20200721194103/https://www.birminghamal.gov/2020/03/25/frequently-asked-questions-about-birminghams-shelter-in-place-ordinance/    https://web.archive.org/web/20200721194547/https://www.birminghamal.gov/2020/04/03/city-of-birminghams-shelter-in-place-order-has-been-extended-to-april-30/",NA,NA,"On March 27, the City of Montgomery instituted a nightly curfew from 10 pm to 5 am that included a ban on gatherings of 10 or more people as well as all gatherings where social distancing could not be maintained.    https://web.archive.org/web/20200721194712/https://www.montgomeryal.gov/Home/Components/News/News/1892/193","On March 27 (effective date: March 28), the Governor and the State Health Officer issued an order including a ban on non-work gatherings of 10 or more people, as well as gatherings of any size where social distancing could not be maintained. This order also closed entertainment venues and sports facilities.     https://web.archive.org/web/20200715235944/https://www.alabamapublichealth.gov/legal/assets/order-adph-cov-gatherings-032720.pdf   https://web.archive.org/web/20200721195407/https://alabamapublichealth.gov/news/2020/03/28.html",NA,NA,NA,NA,NA,NA,"The State Health Officer issued a Statewide ""Stay at Home"" Order, effective Saturday, April 4, 2020, at 5:00 P.M., which states that ""a person may leave his or her place of residence to participate in outdoor activity that involves fewer than 10 people so long as the person maintains a consistent six-foot distance from other persons.""  The Order expired on April 30, 2020.    See Order of the State Health Officer:   http://archive.today/2020.08.04-144925/https://www.alabamapublichealth.gov/legal/assets/soe-covid19-040320.pdf    See detailed components listed down on the official governor's website:   http://archive.today/xVtVb",NA,NA,NA,NA,NA,NA,NA,NA,NA,NA,NA,NA,NA,NA,NA,NA,NA,NA,NA,NA,NA,NA,NA,NA,NA,"On April 30, the “Safer at Home” Order replaced the April 3 “Stay at Home” Order. Under this new order, the March 28 ban on gatherings of 10 or more people and gatherings where social distancing couldn’t be maintained was extended. A broader “drive-in” event exception was introduced, permitting larger events provided all participants remain in their vehicles. Entertainment venues and athletic facilities remained closed.     https://web.archive.org/web/20200721200504/https://alabamapublichealth.gov/legal/assets/order-adph-cov-gatherings-042820.pdf    https://web.archive.org/web/20200721200907/https://alabamapublichealth.gov/news/2020/04/28c.html    https://web.archive.org/web/20200721201022/https://governor.alabama.gov/assets/2020/04/GKI-0040-2020-Health-Order-Update-Info-Sheet.pdf    On April 30, the City of Birmingham instituted a nightly curfew to replace its “Shelter in Place” ordinance. The curfew was in effect from 10 pm to 5 am until May 15. The curfew constituted a de facto ban on public events between those hours.	    https://web.archive.org/web/20200721201116/https://www.birminghamal.gov/2020/05/05/frequently-asked-questions-on-the-city-of-birminghams-curfew-ordinance/",NA,NA,NA,NA,NA,NA,NA,NA,NA,NA,"On May 11, the amended Safer at Home order of May 8 went into effect. This order lifted the 10 person gathering limit, allowing gatherings of any size, so long as maintaining a six-foot distance between all participants was possible. Some athletic facilities could reopen, but events where social distancing was impossible remained prohibited. Entertainment venues remained closed. This in effect permitted some public events but prohibited others. The Alabama Department of Public Health also issued social distancing and sanitation guidance for places of worship to follow for religious services.    https://web.archive.org/web/20200721201557/https://alabamapublichealth.gov/legal/assets/order-adph-cov-gatherings-050820.pdf    https://web.archive.org/web/20200716002801/https://governor.alabama.gov/assets/2020/05/GKI-0040-2020-Health-Order-Update-Info-Sheet-Amended-Safer-at-Home-FNL.pdf    https://web.archive.org/web/20200721202304/https://alabamapublichealth.gov/covid19/assets/cov-sah-worship.pdf",NA,NA,NA,NA,NA,NA,NA,NA,NA,NA,"On May 22, the amended Safer at Home order went into effect, allowing entertainment venues to reopen provided they follow social distancing and sanitation guidelines. Indoor and enclosed venues were required to cap occupancy at 50% of the normal occupancy load allowed by the fire marshal. Athletic venues were allowed to reopen as well, and sports teams allowed to practice, with competition permitted on June 15. The Department of Public Health issued specific guidance for businesses in these sectors, including for resumption of public events.    In effect, this order removed the statewide prohibition on public events.    The same day, the Jefferson County Health Officer issued an order extending the closure of entertainment venues there until June 6, extending the partial prohibition of public events there.    https://web.archive.org/web/20200721204554/https://alabamapublichealth.gov/legal/assets/order-jchd-gatherings-052220.pdf    https://web.archive.org/web/20200721203255/https://governor.alabama.gov/assets/2020/05/GKI-0040-2020-Health-Order-Update-May-22-DFT4-Horizontal-Info-Sheet-002.pdf    https://web.archive.org/web/20200721203630/https://alabamapublichealth.gov/legal/assets/order-adph-cov-gatherings-052120.pdf    https://web.archive.org/web/20200718122742/http://www.alabamapublichealth.gov/covid19/assets/cov-sah-entertainment-tourist.pdf    https://web.archive.org/web/20200715104001/https://alabamapublichealth.gov/covid19/assets/cov-sah-athletic-activities.pdf",NA,NA,NA,NA,NA,NA,NA,NA,NA,NA,NA,NA,NA,NA,"On June 6, Jefferson County’s extended closure of entertainment venues expired, ending targeted prohibitions of public events.    https://web.archive.org/web/20200721204554/https://alabamapublichealth.gov/legal/assets/order-jchd-gatherings-052220.pdf",NA,NA,NA,NA,NA,NA,NA,NA,NA,NA,NA,NA,NA,NA,NA,NA,NA,NA,NA,NA,NA,NA,NA,"On June 30, the Safer at Home order was extended until July 31. No major changes were included in the extension, and all social distancing requirements for public events were preserved.    https://web.archive.org/web/20200716004910/https://governor.alabama.gov/assets/2020/06/2020-06-30-Safer-at-Home-Order.pdf    https://web.archive.org/web/20200721205301/https://governor.alabama.gov/assets/2020/06/GKI-0040-2020-Health-Order-Update-Ends-July-31-Horizontal-Info-Sheet-FNL.pdf",NA,NA,NA,NA,NA,NA,NA,NA,NA,NA,NA,NA,NA,NA,NA,NA,NA,NA,NA,NA,NA,NA,NA,NA,NA,NA,NA,NA,"On July 29, the Safer at Home order was extended until August 31. No major changes were included in the extension, and all social distancing requirements for public events were preserved.    https://web.archive.org/web/20200809170307/https://alabamapublichealth.gov/legal/assets/order-adph-cov-gatherings-072920.pdf    https://web.archive.org/web/20200809171018/https://governor.alabama.gov/assets/2020/07/GKI_Health-Order-Update_Aug_31_Vertical.pdf",NA,NA,NA,NA,NA,NA,NA,NA,NA,NA,NA,NA,NA,NA,NA,NA,NA,NA,NA,NA,NA,NA,NA,NA,NA,NA,NA,NA,"On August 27, Governor Ivey extended the ""Safer at Home"" order until October 2. No major changes were introduced. The recommendation that public events be cancelled continues.    https://web.archive.org/web/20200827201707/https://governor.alabama.gov/assets/2020/08/Safer-at-Home-Order-Final-8.27.20.pdf",NA,NA,NA,NA,NA,NA,NA,NA,NA,NA,NA,NA,NA,NA,NA,NA,NA,NA,NA,NA,NA,NA,NA,NA,NA,NA,NA,NA,NA,NA,NA,NA,"On Sept. 29, the Governor extended the “Safer at Home” order until November 8. No major changes were introduced. The recommendation that public events be cancelled continues.    https://web.archive.org/web/20201001090822/https://governor.alabama.gov/assets/2020/09/Safer-at-Home-Order-Final-9.29.2020.pdf    https://web.archive.org/web/20201001091147/https://governor.alabama.gov/assets/2020/09/GKI-0040-2020-Health-Order-Update-Nov-8-Horizontal-2.pdf",NA,NA,NA,NA
Alaska,61.3707,-152.4044,NA,NA,NA,NA,NA,NA,NA,NA,NA,NA,NA,NA,NA,NA,NA,NA,NA,NA,NA,NA,NA,NA,NA,NA,NA,NA,NA,NA,NA,NA,NA,NA,NA,NA,NA,NA,NA,NA,NA,NA,NA,NA,NA,NA,NA,NA,NA,NA,NA,NA,NA,"On March 13th, the mayor of Anchorage closed all public facilities and strongly urged the cancellation of public events. See archive: http://archive.today/2020.07.28-074048/https://www.muni.org/Departments/Mayor/PressReleases/Pages/Anchorage-to-close-all-Libraries-and-Civic,-Cultural,-and-Recreational-Facilities.aspx",NA,NA,NA,"On March 17th, the Alaska governor announced that all public entities and their events announced as closed/cancelled until March 31st. See archive:   https://web.archive.org/web/20200718115712/https://gov.alaska.gov/wp-content/uploads/sites/2/03.16.20-COVID-19-Health-Mandate-002.pdf",NA,NA,NA,NA,NA,NA,NA,NA,NA,NA,NA,NA,NA,NA,NA,NA,NA,NA,NA,NA,NA,NA,NA,NA,NA,NA,NA,NA,NA,NA,NA,NA,NA,NA,NA,NA,NA,"On April 24th, the governor of Alaska stated that gatherings of 20 or less were allowed if  social distancing and health guidelines were met (both indoor and outdoor). See archive: https://web.archive.org/web/20200430041322/https://gov.alaska.gov/wp-content/uploads/sites/2/0425-COVID-MANDATE-016-Attachment-N-Social-Religious-and-Other-Gatherings.pdf",NA,NA,NA,NA,NA,NA,NA,NA,NA,NA,NA,NA,NA,"On May 8th, the governor of Alaska stated that gatherings of 50 or less were allowed if  social distancing and health guidelines were met (both indoor and outdoor). See archive: https://web.archive.org/web/20200513172537/https://covid19.alaska.gov/wp-content/uploads/2020/05/05072020-Phase-II-016-Attachment-N-Revised-Social-Religious-and-Other-Gatherings.pdf",NA,NA,NA,NA,NA,NA,NA,NA,NA,NA,NA,NA,NA,"On May 22nd, the governor of Alaska stated that all gatherings were permitted as long as large gatherings consulted public health before scheduling. See archive: https://covid19.alaska.gov/wp-content/uploads/2020/05/05192020-Alaskas-Plan-Forward-Final.pdf",NA,NA,NA,NA,NA,NA,"On May 29th, the governor of Alaska updated the guidelines for large (>250 people) gatherings to include specific requirements. See archive: https://covid19.alaska.gov/wp-content/uploads/2020/06/06012020-Large-Gatherings-and-Community-Events.pdf",NA,NA,NA,NA,NA,NA,NA,NA,NA,NA,NA,NA,NA,NA,NA,NA,NA,NA,NA,NA,NA,NA,NA,NA,NA,NA,NA,NA,NA,NA,NA,NA,NA,NA,NA,NA,NA,NA,NA,NA,NA,NA,NA,NA,NA,NA,NA,NA,NA,NA,NA,NA,NA,NA,NA,NA,NA,NA,NA,NA,NA,NA,NA,NA,NA,NA,NA,NA,NA,NA,NA,NA,NA,NA,NA,NA,NA,NA,NA,NA,NA,NA,NA,NA,NA,NA,NA,NA,NA,NA,NA,NA,NA,NA,NA,NA,NA,NA,NA,NA,NA,NA,NA,NA,NA,NA,NA,NA,NA,"No changes detected in this indicator after searching news articles, press releases and executive orders.",NA,"No changes detected in this indicator after searching news articles, press releases and executive orders.",NA,NA,NA,NA,NA,NA,NA,NA,NA,NA,"No changes detected in this indicator after searching news articles, press releases and executive orders.",NA,NA,NA,NA
Arizona,33.7298,-111.4312,NA,NA,NA,NA,NA,NA,NA,NA,NA,NA,NA,NA,NA,NA,NA,NA,NA,NA,NA,NA,NA,NA,NA,NA,NA,NA,NA,NA,NA,NA,NA,NA,NA,NA,NA,NA,NA,NA,NA,NA,NA,NA,NA,NA,NA,NA,NA,NA,NA,NA,NA,NA,NA,NA,"On March 16, Arizona released new guidance for dining establishments, child care providers, nursing homes, and additional social distancing measures. Recommends canceling or postponing gatherings of 10 or more people. https://web.archive.org/web/20200716073753/https://azgovernor.gov/governor/news/2020/03/arizonas-covid-19-actions-date",NA,NA,Public events cancellation recommended  https://web.archive.org/web/20200622173745/https://azgovernor.gov/file/34251/download?token=avmge6FQ,NA,NA,NA,NA,NA,NA,NA,NA,NA,NA,NA,Public events are not recommended but not completely restricted.  https://web.archive.org/web/20200725070241/https://directorsblog.health.azdhs.gov/contact-tracing-can-help-public-health-to-slow-the-spread-of-diseases/,NA,NA,NA,NA,NA,NA,NA,NA,NA,NA,NA,NA,NA,NA,NA,NA,NA,NA,NA,NA,NA,NA,NA,NA,NA,NA,NA,NA,NA,"EO2020-33 bans businesses and other organizations from holding ""any gatherings with 10 persons or more,"" effectively requiring cancelling most public events. https://web.archive.org/web/20200716071205/https://azgovernor.gov/file/34712/download?token=aWa7Jw6L",NA,NA,NA,NA,NA,NA,NA,NA,NA,NA,NA,NA,NA,NA,NA,"EO2020-36 requires businesses and all other public-facing institutions to ""limit the congregation of people to no more than 10 persons when feasible and in relation to the size of the location,"" effectively banning most public events in the state. Hence, 2G maintained. https://web.archive.org/web/20200716072008/https://azgovernor.gov/file/34817/download?token=9X8aggcf",NA,NA,NA,NA,NA,NA,NA,NA,NA,NA,NA,NA,NA,NA,NA,NA,NA,NA,NA,NA,NA,NA,NA,NA,NA,NA,NA,NA,NA,NA,NA,NA,NA,NA,NA,NA,NA,NA,NA,NA,NA,NA,NA,"With EO2020-43, effective June 29, 2020, organized public events of more than 50 people are prohibited unless the city, town or county in unincorporated areas has approved the event, and only if adequate safety precautions are implemented, including physical distancing measures.”    https://web.archive.org/web/20200724064407/https://azgovernor.gov/file/35147/download?token=4zgksq5W",NA,NA,NA,NA,NA,NA,NA,NA,NA,NA,NA,NA,NA,NA,NA,NA,NA,NA,NA,NA,NA,NA,NA,NA,NA,NA,NA,NA,NA,NA,NA,NA,NA,NA,"Although policy doesn't mention public events, the following are suggestive of a level 2.   1. Public gatherings of >50 persons is banned.   2. Indoor theatres and water parks are closed.   3. General stay at home orders and pause on reopening even for smaller businesses such as gyms     https://web.archive.org/web/20200819070825/https://azdhs.gov/preparedness/epidemiology-disease-control/infectious-disease-epidemiology/index.php#novel-coronavirus-community",NA,NA,NA,NA,NA,NA,NA,"Provisions of Executive Order 2020-43, extended by 2020-52, expired on August 10, 2020. https://web.archive.org/web/20200901214808/https://azgovernor.gov/governor/news/2020/07/governor-ducey-issues-executive-order-further-protect-public-health",NA,NA,NA,NA,NA,NA,NA,NA,NA,NA,NA,NA,NA,NA,NA,NA,NA,NA,NA,NA,NA,NA,NA,NA,NA,NA,NA,NA,NA,NA,NA,No new measures have been introduced. Previously noted policies remain valid.,NA,NA,NA,NA,No policy change noted.,NA,NA,NA,NA,NA,NA,NA,No policy change noted.,NA,NA,NA,NA,NA,NA,NA,NA
Arkansas,34.9697,-92.3731,NA,NA,NA,NA,NA,NA,NA,NA,NA,NA,NA,NA,NA,NA,NA,NA,NA,NA,NA,NA,NA,NA,NA,NA,NA,NA,NA,NA,NA,NA,NA,NA,NA,NA,NA,NA,NA,NA,NA,NA,NA,NA,NA,NA,NA,NA,NA,NA,NA,NA,NA,"On 12 March 2020, the governor advised against gatherings larger than 200 people in the counties in Saline, Jefferson, Pulaski and Grant counties . See Arkansas democrat gazette, archived: https://web.archive.org/web/20200314163626/https://www.arkansasonline.com/news/2020/mar/13/3-more-coronavirus-cases-state-gov-says-1-patient-/","On 12 March 2020, the governor advised against gatherings larger than 200 people in the counties in Saline, Jefferson, Pulaski and Grant counties . See Arkansas democrat gazette, archived: https://web.archive.org/web/20200314163626/https://www.arkansasonline.com/news/2020/mar/13/3-more-coronavirus-cases-state-gov-says-1-patient-/","On 12 March 2020, the governor advised against gatherings larger than 200 people in the counties in Saline, Jefferson, Pulaski and Grant counties . See Arkansas democrat gazette, archived: https://web.archive.org/web/20200314163626/https://www.arkansasonline.com/news/2020/mar/13/3-more-coronavirus-cases-state-gov-says-1-patient-/","On 16 March 2020, the governor advised against gatherings larger than 50 people as per recommended by the CDC . See Arkansas democrat gazette, archived: https://web.archive.org/web/20200318144807/https://www.arkansasonline.com/news/2020/mar/16/coronavirus-cases-total-22-monday-arkansas-health-/",NA,NA,NA,NA,NA,NA,NA,NA,NA,NA,"Governor Hutchinson limited gatherings of more than ten people effective March 27. While public events are not specifically mentioned, it’s implied.     http://archive.vn/hdodw",NA,NA,NA,NA,NA,NA,NA,NA,NA,NA,NA,NA,NA,NA,NA,NA,NA,NA,NA,NA,NA,NA,NA,NA,NA,NA,NA,NA,NA,NA,NA,NA,NA,NA,NA,NA,NA,"Governor Hutchinson is allowing 50 or fewer people to gather in outdoor arenas for sports games, race tracks, etc. but it seems public events are still canceled, postponed or rescheduled.   http://archive.vn/iuY1Z    Here’s a list of things that are either postponed, rescheduled, now done remotely or cancelled.   http://archive.vn/ZMBLH",NA,NA,NA,NA,NA,NA,NA,NA,NA,NA,NA,NA,NA,NA,NA,NA,NA,NA,NA,NA,NA,NA,NA,NA,NA,NA,NA,NA,NA,NA,NA,NA,NA,NA,NA,NA,NA,NA,NA,NA,NA,NA,NA,NA,NA,NA,NA,NA,NA,NA,NA,NA,NA,NA,NA,NA,NA,NA,NA,NA,NA,NA,NA,NA,NA,NA,NA,NA,NA,NA,NA,NA,NA,NA,NA,NA,NA,NA,NA,NA,NA,NA,NA,NA,NA,NA,NA,NA,NA,NA,NA,NA,NA,NA,NA,NA,NA,NA,NA,NA,NA,NA,NA,NA,NA,NA,NA,NA,NA,NA,NA,NA,NA,NA,NA,NA,NA,NA,NA,NA,NA,NA,NA,NA,NA,NA,NA,NA,NA,NA,NA,NA,NA,NA,NA,NA,NA,NA,NA,NA,"No update - some examples of local coronavirus closures, cancellations and postponements as it relates to public events as of 22 September:    Concerts:  Dave Matthews Band at the Walmart AMP for September 22 is rescheduled to September 21, 2021  Delta Roots Music Festival in Helena is canceled  Gulley Park Concert Series is canceled for 2020    Events:  Bentonville Parks & Recreations is suspending all youth sports programs until further notice  Bikes, Blues & BBQ on September 23 – 26 is canceled  Centerton Day is canceled  Christmas Honors at the Fort Smith National Cemetery on December 2 and 5 is canceled  City of Fayetteville suspended spring events and programs at parks facilities until further notice  Fayetteville Chamber of Commerce has postponed all events until further notice  The Hot Cocoa Crawl on November 28 is canceled  Jewels of Giving Gala for November 13 is canceled  Lights of the Ozarks parade and tree lighting November 20 will be virtual  Lincoln Apple Festival in October is canceled  Oktoberfest on the Square in Fayetteville on October 18 is canceled  Opera in the Ozarks summer season for 2020 is canceled  The Steel Horse Rally in Fort Smith has been rescheduled to May 7 & 8, 2021  Symphony of Northwest Arkansas’ has suspended future concerts    Sports:  2020 Masters Tournament has been rescheduled to November 9 – 15. The Augusta National Women’s Amateur has been canceled.  NCAA canceled all fall tournaments  Northwest Arkansas Naturals have canceled all 2020 season games  XFL cancels regular-season games. Games resume in 2021.    https://web.archive.org/web/20200930145545/https://www.nwahomepage.com/lifestyle/health/coronavirus/arkansas-local-coronavirus-closures/",NA,NA,NA,NA,NA,NA,NA,NA,NA,NA,NA
