Idaho,NA,NA,NA,NA,NA,NA,NA,NA,NA,NA,NA,NA,NA,NA,NA,NA,NA,NA,NA,NA,NA,NA,NA,NA,NA,NA,NA,NA,NA,NA,NA,NA,NA,NA,NA,NA,NA,NA,NA,NA,NA,NA,NA,NA,NA,NA,NA,NA,NA,NA,NA,NA,NA,NA,NA,NA,NA,NA,NA,NA,NA,NA,NA,"On March 25, governor ordered people to stay at home ""except to provide or obtain essential services"" or exercise outdoors maintaining a 6' distance between others.  http://archive.fo/E52Ir  original URL  https://coronavirus.idaho.gov/wp-content/uploads/2020/06/statewide-stay-home-order_032520.pdf",NA,NA,NA,NA,NA,NA,NA,NA,NA,NA,NA,NA,NA,NA,NA,NA,NA,NA,NA,NA,"On 15 April, governor extended the 25 March Stay at Home order until April 30.  https://web.archive.org/web/20200711150941/https://coronavirus.idaho.gov/wp-content/uploads/2020/06/amended-statewide-stay-home-order_041520.pdf",NA,NA,NA,NA,NA,NA,NA,NA,NA,NA,NA,NA,NA,NA,NA,"1 May Stay Healthy order recommends that vulnerable people still self-isolate and that those who live with them and are returning to work take steps to shield them upon return home.  In addition non-essential travel is to be ""avoided or minimized.""  https://web.archive.org/web/20200711153428/https://coronavirus.idaho.gov/wp-content/uploads/2020/06/stay-healthy-order-stage1.pdf",NA,NA,NA,NA,NA,NA,NA,NA,NA,NA,NA,NA,NA,NA,The 16 May Stay Healthy order stated that all vulnerable people must continue to self-isolate.   Family members living with them should take steps to shield them on return home.  https://web.archive.org/save/https://coronavirus.idaho.gov/wp-content/uploads/2020/06/stay-healthy-order-stage2.pdf,NA,NA,NA,NA,NA,NA,NA,NA,NA,NA,NA,NA,NA,"30 May Stay Healthy Phase 3 order allows vulnerable individuals to  resume public interactions but take precautionary measures"" including face masks and physical distancing.  If that is impossible then recommend staying at home.  https://web.archive.org/web/20200715222227/https://coronavirus.idaho.gov/wp-content/uploads/2020/06/stay-healthy-order-stage3.pdf",NA,NA,NA,NA,NA,NA,NA,NA,NA,NA,NA,NA,NA,"As of 13 June the Phase 4 Stay Healthy guidelines, there are no general limitations on any group.  Vulnerable individuals ""may resume public interactions but should take precautionary measures including physical distancing and mask wearing.  https://web.archive.org/web/20200715220533/https://rebound.idaho.gov/stage-4-stay-healthy-guidelines/",NA,NA,NA,NA,NA,NA,NA,NA,NA,NA,NA,NA,NA,NA,NA,NA,NA,NA,NA,NA,NA,NA,NA,NA,NA,NA,NA,NA,NA,NA,NA,NA,NA,NA,NA,NA,NA,NA,NA,NA,NA,NA,NA,NA,NA,NA,NA,NA,NA,NA,NA,NA,NA,NA,NA,NA,NA,NA,NA,NA,NA,NA,NA,NA,NA,NA,NA,NA,NA,NA,NA,NA,NA,NA,NA,NA,NA,NA,NA,NA,NA,NA,NA,NA,NA,NA,NA,NA,NA,NA,NA,NA,NA,NA,NA,NA,NA,NA,NA,NA,NA,NA,NA,NA,NA,NA,NA,NA,NA,NA,NA,NA,NA,NA,NA,NA
Illinois,NA,NA,NA,NA,NA,NA,NA,NA,NA,NA,NA,NA,NA,NA,NA,NA,NA,NA,NA,NA,NA,NA,NA,NA,NA,NA,NA,NA,NA,NA,NA,NA,NA,NA,NA,NA,NA,NA,NA,NA,NA,NA,NA,NA,NA,NA,NA,NA,NA,NA,NA,NA,NA,NA,NA,NA,"The City of Chicago orders people who are sick with COVID-19 symptoms to stay at home. Under the order, any person who previously had COVID-19 symptoms can only leave the house only after until 7 days have passed since their symptoms first appeared and until they have been fever free for at least 3 days without the use of medicine. The order emphasizes that people who are sick should separate themselves from other people, including any other family members at home.    http://archive.vn/gJ5Gy",NA,NA,"Executive order requires all Illinois residents to stay at home, with the exception for essential activities or for outdoor activity or to care for someone.     http://archive.vn/YBkdo",NA,NA,NA,NA,NA,NA,NA,NA,NA,NA,Original stay at home order extended until 30 April  http://archive.vn/wip/Y4aTi,NA,NA,NA,NA,NA,NA,NA,NA,NA,NA,NA,NA,NA,NA,NA,NA,NA,NA,NA,NA,NA,NA,NA,NA,NA,NA,NA,NA,NA,"Stay at Home orders extended effective 01 May, 2020  http://archive.vn/xuFkT",NA,NA,NA,NA,NA,NA,NA,NA,NA,NA,NA,NA,NA,NA,NA,NA,NA,NA,NA,NA,NA,NA,NA,NA,NA,NA,NA,"On 29 May, Illinois Governor JB Pritzker released Executive Order 2020-39 which reissued EO 2020-32 which states, “individuals may leave their residence only to perform Essential Activities...”  EO 2020-39 is “extended through June 27, 2020 or until corresponding legislation is enacted and takes effect, whichever occurs first.”   https://web.archive.org/web/20200719195651/https://www2.illinois.gov/Pages/Executive-Orders/ExecutiveOrder2020-39.aspx     EO 2020-32: http://archive.vn/xuFkT#selection-1015.0-1015.195",NA,NA,NA,NA,NA,NA,NA,NA,NA,NA,NA,NA,NA,NA,NA,NA,NA,NA,NA,NA,NA,NA,NA,NA,NA,NA,NA,"On 26 June, Illinois Governor JB Pritzker opened up restaurants, bars, and entertainment centers under public health guidelines. While the Executive Order does not explicitly state citizens can leave their home for non-essential activities, it is implied.     https://web.archive.org/web/20200721161846/https://www2.illinois.gov/Pages/Executive-Orders/ExecutiveOrder2020-43.aspx",NA,NA,NA,NA,NA,NA,NA,NA,NA,NA,NA,NA,NA,NA,NA,NA,NA,NA,NA,NA,NA,NA,NA,NA,NA,NA,NA,"On 24 July, Illinois Governor JB Pritzker extended the former Executive Order for restaurants, bars, and entertainment centers to have limited openings under public health guidelines. While the Executive Order does not explicitly state citizens can leave their home for non-essential activities, it is implied. (Likely until 22 August, as that’s when the second Executive Order also released 24 July is extended to.)     Executive Order 48: https://web.archive.org/web/20200726214044/https://www2.illinois.gov/Pages/Executive-Orders/ExecutiveOrder2020-48.aspx",NA,NA,NA,NA,NA,NA,NA,NA,NA,NA,NA,NA,NA,NA,NA,NA,NA,NA,NA,NA,NA,NA,NA,NA,NA,NA,NA,"On 21 August, in Executive Order 2020-52, the Governor reissued most executive orders, extending a majority of the provisions through September 19, 2020.    This includes the previous orders for restaurants, bars, and entertainment centers to have limited openings under public health guidelines. While the Executive Order does not explicitly state citizens can leave their home for non-essential activities, it is implied.    https://web.archive.org/web/20200825204032/https://www2.illinois.gov/Pages/Executive-Orders/ExecutiveOrder2020-52.aspx",NA,NA,NA,NA,NA,NA,NA,NA,NA,NA,NA,NA,NA,NA,NA,NA,NA,NA,NA,NA,NA,NA,NA,NA,NA,NA,NA,NA,NA,NA,NA,NA,NA,NA,NA,NA,NA,NA,NA,NA,NA,NA,NA,NA,NA,NA,NA
Indiana,NA,NA,NA,NA,NA,NA,NA,NA,NA,NA,NA,NA,NA,NA,NA,NA,NA,NA,NA,NA,NA,NA,NA,NA,NA,NA,NA,NA,NA,NA,NA,NA,NA,NA,NA,NA,NA,NA,NA,NA,NA,NA,NA,NA,NA,NA,NA,NA,NA,NA,NA,NA,NA,NA,NA,"Indianapolis Mayor Joe Hogsett urges residents to ""minimize travel except to and from work, in emergency situations, or to purchase groceries and pick up prescriptions or food"" starting on 17 March.     See Press Release:  http://web.archive.org/web/20200714161430/https://citybase-cms prod.s3.amazonaws.com/07b68ca6663b404e8e47e3d8553b455f.pdf",NA,NA,NA,NA,NA,NA,NA,"Effective March 25, Governor Eric Holcomb directs via Executive Order 20-08 all individuals to stay at home or place of residence. Individuals may leave for ""essential activities"" including for health and safety, outdoor exercise, procurement of necessary supplies, to care for others (including family, friends, and pets).    See Executive Order 20-08:  http://web.archive.org/web/20200713164805/https://www.in.gov/gov/files/Executive_Order_20-08_Stay_at_Home.pdf",NA,NA,NA,NA,NA,NA,NA,NA,NA,NA,NA,NA,NA,NA,NA,NA,NA,"On 4 July, all counties except Elkhart County will move to Stage 4.5 of Governor Eric Holcomb's ""Back on Track"" plan. With the vast majority, if not all, offices and public spaces open, and with the state recommending working remotely ""as needed,"" hence there is no longer a general recommendation to stay home. However, because Elkhart County remains on Stage 4 towards July, the advice for that region is to ""remain at home or their place of residence as much as practicable to mitigate the spread of COVID-19,"" as highlighted by Executive Order 20-32.      See document on Stage 4.5 by the State Government:  http://web.archive.org/web/20200716013117/https://backontrack.in.gov/files/Stage_4.5.pdf    See Executive Order 20-32:  http://web.archive.org/web/20200716020137/https://www.in.gov/gov/files/Executive%20Order%2020-32%20%28Stage%204%29.pdf",NA,NA,NA,NA,NA,NA,NA,NA,NA,NA,NA,NA,NA,NA,NA,NA,NA,NA,NA,NA,NA,NA,NA,NA,NA,NA,NA,NA,NA,NA,NA,NA,NA,NA,NA,NA,NA,NA,NA,NA,NA,NA,NA,NA,NA,NA,NA,NA,NA,NA,NA,NA,NA,NA,NA,NA,NA,NA,NA,NA,NA,NA,NA,NA,NA,NA,NA,NA,NA,NA,NA,NA,NA,NA,NA,NA,NA,NA,NA,NA,NA,NA,NA,NA,NA,NA,NA,NA,NA,NA,NA,NA,NA,NA,NA,NA,NA,NA,NA,NA,NA,NA,NA,NA,NA,NA,NA,NA,NA,NA,"On August 1st, Elkhart County moved to stage 4.5 of the ""Back on Track Indiana"" plan. Under the plan, residents weren't recommended to stay home.    Elkhart County Announcement: http://web.archive.org/web/20200802113027/https://www.wndu.com/2020/08/01/elkhart-county-to-join-rest-of-state-at-stage-45-of-reopening/     Back on Track Indiana Stage 4.5 Plan: http://web.archive.org/web/20200802112620/https://backontrack.in.gov/files/Stage4.5_Aug-1_update.pdf",NA,NA,NA,NA,NA,NA,NA,NA,NA,NA,NA,NA,NA,NA,NA,NA,NA,NA,NA,NA,NA,NA,NA,NA,NA,NA,NA,NA,NA,NA,NA,NA,NA,NA,NA,NA,NA,NA,NA,NA,NA,NA,NA,NA,NA,NA,NA,NA,NA,NA,NA,NA,NA,NA,NA,NA,NA,NA,NA,NA,NA,NA,NA,NA,NA,NA,NA
Iowa,NA,NA,NA,NA,NA,NA,NA,NA,NA,NA,NA,NA,NA,NA,NA,NA,NA,NA,NA,NA,NA,NA,NA,NA,NA,NA,NA,NA,NA,NA,NA,NA,NA,NA,NA,NA,NA,NA,NA,NA,NA,NA,NA,NA,NA,NA,NA,NA,NA,NA,NA,NA,NA,NA,NA,NA,NA,NA,NA,The mayor of Des Moines recommended residents to stay home.    http://web.archive.org/web/20200728121249/https://www.dsm.city/news_detail_T2_R169.php,Residents are recommended to stay home.    http://web.archive.org/web/20200728114112/http://www.iowapbs.org/video/story/36100/Iowa-gov-kim-reynolds-press-conference-march-23-2020-230-pm,NA,NA,NA,NA,NA,NA,NA,NA,NA,NA,NA,NA,NA,NA,NA,NA,NA,NA,NA,NA,NA,NA,NA,NA,NA,NA,NA,NA,NA,NA,NA,NA,NA,NA,NA,NA,NA,NA,NA,NA,NA,NA,NA,NA,NA,NA,NA,NA,NA,NA,NA,NA,NA,NA,NA,NA,NA,NA,NA,NA,NA,NA,NA,NA,NA,NA,NA,NA,NA,NA,NA,NA,NA,NA,NA,NA,NA,NA,NA,NA,NA,NA,NA,NA,NA,NA,NA,NA,NA,NA,NA,NA,NA,NA,NA,NA,NA,NA,NA,NA,NA,NA,NA,NA,NA,NA,NA,NA,NA,NA,NA,NA,NA,NA,NA,NA,NA,NA,NA,NA,NA,NA,NA,"On July 24th, Governor Kim Reynolds still urged vulnerable Iowans to stay home.   http://web.archive.org/web/20200728055905/https://governor.iowa.gov/sites/default/files/documents/Public%20Health%20Proclamation%20-%202020.07.24%20%282%29.pdf",NA,NA,NA,NA,NA,NA,NA,NA,NA,NA,NA,NA,NA,NA,NA,NA,NA,NA,NA,NA,NA,NA,NA,NA,NA,NA,NA,"On August 21st, Iowa Governor Kim Reynolds continued to urge vulnerable Iowans to stay home.     http://web.archive.org/save/https://governor.iowa.gov/sites/default/files/documents/Public%20Health%20Proclamation%20-%202020.08.21_0.pdf",NA,NA,NA,NA,NA,Iowa Governor Kim Reynolds no longer encouraged vulnerable Iowans to stay home in the latest proclamation.   https://web.archive.org/web/20200828183627/https://governor.iowa.gov/sites/default/files/documents/Public%20Health%20Proclamation%20-%202020.08.27.pdf,NA,NA,NA,NA,NA,NA,NA,NA,NA,NA,NA,NA,NA,NA,NA,NA,NA,NA,NA,NA,NA,NA,NA,NA,NA,NA,NA,NA,NA,NA,NA,NA,NA,NA,NA,NA,NA,NA,NA,NA,NA
Kansas,NA,NA,NA,NA,NA,NA,NA,NA,NA,NA,NA,NA,NA,NA,NA,NA,NA,NA,NA,NA,NA,NA,NA,NA,NA,NA,NA,NA,NA,NA,NA,NA,NA,NA,NA,NA,NA,NA,NA,NA,NA,NA,NA,NA,NA,NA,NA,NA,NA,NA,NA,NA,NA,NA,NA,NA,NA,NA,NA,NA,NA,NA,NA,NA,NA,NA,NA,NA,"Governor Kelly issues a stay at home order, effective March 30. Residents are required to stay home except for essential activities.    https://web.archive.org/web/20200718003441/https://governor.kansas.gov/governor-kelly-issues-temporary-statewide-stay-home-order-in-ongoing-effort-to-combat-covid-19/",NA,NA,NA,NA,NA,NA,NA,NA,NA,NA,NA,NA,NA,NA,NA,NA,NA,NA,NA,NA,NA,NA,NA,NA,NA,NA,NA,NA,NA,NA,NA,NA,NA,NA,Governor Kelly lifts the stay at home requirement as part of phase 1 of the reopening plan. Work from home is recommended if possible.    https://web.archive.org/web/20200702152725/https://governor.kansas.gov/governor-laura-kelly-introduces-plan-to-safely-gradually-re-open-kansas-get-state-back-to-work/,NA,NA,NA,NA,NA,NA,NA,NA,NA,NA,NA,NA,NA,NA,NA,NA,NA,NA,NA,NA,NA,NA,NA,NA,NA,NA,NA,NA,NA,NA,NA,NA,NA,NA,"Phase 3 of Ad Astra (Kansas' reopening plan) recommends that individuals stay at home if they are feeling sick, omitting a recommendation to stay at home otherwise.    https://web.archive.org/web/20200630103741/https://knss.radio.com/articles/governor-kelly-recommends-kansas-move-into-phase-3",NA,NA,NA,NA,NA,NA,NA,NA,NA,NA,NA,NA,NA,NA,NA,NA,NA,NA,NA,NA,NA,NA,NA,NA,NA,NA,NA,NA,NA,NA,NA,NA,NA,NA,NA,NA,NA,NA,NA,NA,NA,NA,NA,NA,NA,NA,NA,NA,NA,NA,NA,NA,NA,NA,NA,NA,NA,NA,NA,NA,NA,NA,NA,NA,NA,NA,NA,NA,NA,NA,NA,NA,NA,NA,NA,NA,NA,NA,NA,NA,NA,NA,NA,NA,NA,NA,NA,NA,NA,NA,NA,NA,NA,NA,NA,NA,NA,NA,NA,NA,NA,NA,NA,NA,NA,NA,NA,NA,NA,NA,NA,NA,NA,NA,NA,NA,NA,NA,NA,NA,NA
Kentucky,NA,NA,NA,NA,NA,NA,NA,NA,NA,NA,NA,NA,NA,NA,NA,NA,NA,NA,NA,NA,NA,NA,NA,NA,NA,NA,NA,NA,NA,NA,NA,NA,NA,NA,NA,NA,NA,NA,NA,NA,NA,NA,NA,NA,NA,NA,NA,NA,NA,NA,NA,NA,14th March  ?Took the steps to force a home isolation when the COVID-19 patient initially refused to self-quarantine.  https://web.archive.org/web/20200616114144/https://governor.ky.gov/covid-19,NA,NA,17th March  Older people at care facilities should expect to shelter in place  https://web.archive.org/web/20200616114144/https://governor.ky.gov/covid-19,NA,NA,NA,NA,NA,NA,NA,NA,"March 26th  ‘Healthy at Home’ measure. Gov. Beshear has taken decisive actions and encouraged all Kentuckians to remain Healthy at Home. Beginning at 8 p.m. Thursday 26th March, all non-life-sustaining businesses must close to in-person services. Exempted businesses include grocery stores, gas stations, hardware stores and media outlets, among many others. The sale of firearms and ammunition also is exempted.    Gov. Beshear clarified that the state's campaign amounted to telling residents to stay home. ""That doesn't mean you need to cower down in your home,"" he said. But ""you stay at home, unless you are getting groceries or other supplies that you may need.""     Gov. Beshear said. “Your specific actions make a difference in how protected the population is. So remember, it is your patriotic duty as an American, your duty as a Kentuckian to stay healthy at home.”      Non essential businesses closed and gatherings remain prohibited  https://web.archive.org/web/20200616114144/https://governor.ky.gov/covid-19  https://web.archive.org/web/20200616144917/https://www.nytimes.com/interactive/2020/us/coronavirus-stay-at-home-order.html  https://web.archive.org/web/20200617125105/https://kentucky.gov/Pages/Activity-stream.aspx?n=GovernorBeshear&prId=105  https://web.archive.org/web/20200618154827/https://www.eaglecountryonline.com/news/local-news/gov-beshear-implores-all-kentuckians-to-follow-guidance-stay-home-in-covid-19-fight/",NA,NA,NA,NA,NA,NA,NA,NA,NA,NA,NA,NA,NA,NA,NA,NA,NA,NA,NA,NA,NA,NA,NA,NA,NA,NA,NA,NA,NA,NA,NA,NA,NA,NA,NA,NA,NA,NA,NA,NA,NA,NA,NA,NA,NA,NA,NA,NA,NA,NA,NA,NA,NA,NA,NA,NA,"22nd May  Restaurants permitted to open which are not an essential service, and groups of 10 people or fewer may gather, so implied that Healthy at Home is now recommended not required. Beshear asked Kentuckians living on the border of states with open restaurants to resist going out, and instead remain “healthy at home.”  https://web.archive.org/web/20200616114144/https://governor.ky.gov/covid-19",NA,NA,NA,NA,NA,NA,NA,NA,NA,NA,NA,NA,NA,NA,NA,NA,NA,NA,NA,NA,NA,NA,NA,NA,NA,NA,NA,NA,NA,NA,NA,NA,NA,NA,NA,NA,NA,"“Next Monday June 29th, just about everything in the commonwealth will be open, from bars, wedding venues, public pools and even Kentucky Kingdom,” the Governor said. “It has been a long road dealing with this virus. But by following medical guidelines we have gone from a time when our cases were doubling every week, to a point where we are safely beginning to reopen businesses and our economy.”  Beginning June 29, people can begin gathering in groups of 50 or fewer people. Adherence to rules on social distancing, mask use and sanitation remains critically important, and people in more vulnerable categories should continue to avoid such gatherings.  https://web.archive.org/web/20200624065327/https://govsite-assets.s3.amazonaws.com/VqL0EOPcTSaH6D7JGrPe_2020-6-22%20-%20HAW%20-%20Bars%20and%20Restaurants%20-%20version%201.0.pdf",NA,NA,NA,NA,NA,NA,NA,NA,NA,NA,NA,NA,NA,NA,NA,NA,NA,NA,NA,NA,NA,NA,NA,NA,NA,NA,NA,NA,NA,NA,NA,NA,NA,NA,NA,NA,NA,NA,NA,NA,NA,NA,NA,NA,NA,NA,NA,NA,NA,NA,NA,NA,NA,NA,NA,NA,NA,NA,NA,NA,NA,NA,NA,NA,NA,NA,NA,NA,NA,NA,NA,NA,NA,NA,NA,NA,NA,NA,NA,NA,NA,NA,NA,NA,NA,NA,NA,NA,NA,NA,NA,NA,NA,NA,NA,NA,NA,NA,NA,NA
Louisiana,NA,NA,NA,NA,NA,NA,NA,NA,NA,NA,NA,NA,NA,NA,NA,NA,NA,NA,NA,NA,NA,NA,NA,NA,NA,NA,NA,NA,NA,NA,NA,NA,NA,NA,NA,NA,NA,NA,NA,NA,NA,NA,NA,NA,NA,NA,NA,NA,NA,NA,NA,NA,NA,NA,NA,NA,NA,NA,NA,NA,NA,"Gov. John Bel Edwards issued a statewide Stay at Home order that goes into effect at 5 p.m. Monday, March 23  People can leave their homes to do essential things like buying groceries or food, pick up medicine or go to work only if their job is essential. If you have to go out, make sure you practice social distancing measures and keep 6 feet between you and the people around you. People are encouraged to go outside and to stay active during this time, as long as they practice social distancing when they are around their neighbors.  The order is set to expire at the end of the night on Sunday, April 12.    https://web.archive.org/web/20200718021644/https://gov.louisiana.gov/order/",NA,NA,NA,NA,NA,NA,NA,NA,NA,NA,NA,NA,NA,NA,NA,NA,NA,NA,NA,NA,The Governor extended the stay-at-home order to 15 May. Link to Governor's office website:   https://web.archive.org/web/20200718145738/https://gov.louisiana.gov/home-order-extended-may15/,NA,NA,NA,NA,NA,NA,NA,NA,NA,NA,NA,NA,NA,NA,NA,NA,NA,NA,NA,NA,NA,NA,NA,NA,NA,NA,NA,NA,NA,NA,NA,"The Governor removes the stay at home order for Louisianans, but continued to recommend that people remain at home. The press release from his office notes that the removal of the order means ""encouraging people who are at a higher risk of becoming ill from COVID-19 to continue to Stay at Home. However, all individuals are still Safer at Home"".   https://web.archive.org/web/20200718095449/https://gov.louisiana.gov/index.cfm/newsroom/detail/2488",NA,NA,NA,"Since May 19, a few days after the beginning of Phase One of reopening on May 16, the New Orleans Health Department website recommended: “Continue to stay home except for essential needs and other permitted activities on a limited basis.”  https://web.archive.org/web/20200519012709/https://ready.nola.gov/incident/coronavirus/safe-reopening/",NA,NA,NA,NA,NA,NA,NA,NA,NA,NA,NA,NA,NA,NA,NA,NA,NA,"The governor's office weakened its stay at home recommendation on June 5, with the Phase Two set of policies. However, there is not ""no policy"" so 1G coding continued. Link to governor's office press release, with the working: ""people who are at high risk for becoming seriously ill from COVID-19, including those over 65 and those with underlying health conditions, should still Stay at Home unless they are completing essential tasks, such as doctor visits or going to purchase medications, food or other necessary items. Everyone should consider their own risk and the risk of those in their households as they plan their public outings.""  https://web.archive.org/web/20200718151115/https://gov.louisiana.gov/index.cfm/newsroom/detail/2521",NA,NA,NA,NA,NA,NA,"Since June 13, the beginning of Phase Two of reopening, the New Orleans Health Department continued to recommend: “Continue to stay home except for essential needs and other permitted activities on a limited basis.” In addition, “Seniors and people with serious medical conditions should continue to stay home.”  https://web.archive.org/web/20200613070829/https://ready.nola.gov/incident/coronavirus/safe-reopening/",NA,NA,NA,NA,NA,NA,NA,NA,NA,NA,NA,NA,NA,NA,NA,NA,NA,NA,NA,NA,NA,NA,NA,NA,NA,NA,NA,NA,NA,NA,NA,NA,NA,NA,"In the extension announcement for Phase Two, it was stated that ""all individuals who are at higher risk of severe illness from COVID19 should stay home"". See Official News Report, archived: http://web.archive.org/web/20200730182744/https://gov.louisiana.gov/index.cfm/newsroom/detail/2605",NA,NA,NA,NA,"On the 23rd of July, an Executive Order was issued by Gov. Edwards to further extend Phase Two till the 7th of August. See official News Report, archived: http://web.archive.org/web/20200730184607/https://gov.louisiana.gov/index.cfm/newsroom/detail/2609",NA,NA,NA,NA,NA,NA,NA,NA,NA,NA,NA,NA,NA,"Governor Edwards issued an executive order to further extend Phase 2 to August 28, which includes the recommendation that all individuals at a higher risk of severe illness from COVID-19 stay at home for all but essential activities.  https://web.archive.org/web/20200813064643/https://gov.louisiana.gov/assets/Proclamations/2020/101-JBE-2020-covid-19-Public-Health-Emergency-Renewal-of-Phase-2.pdf",NA,NA,NA,NA,NA,NA,NA,NA,NA,NA,NA,NA,NA,NA,NA,NA,NA,NA,NA,Aug 26 Gov extends phase two restrictions including closure of bars for two weeks in light of Hurricanes Marco and Laura  http://web.archive.org/web/20200903102439/https://www.wsj.com/articles/coronavirus-latest-news-08-26-2020-11598427633,NA,NA,NA,NA,NA,NA,NA,NA,NA,NA,NA,NA,NA,NA,NA,Aug 26 Gov extends phase two restrictions including closure of bars for two weeks in light of Hurricanes Marco and Laura  http://web.archive.org/web/20200903102439/https://www.wsj.com/articles/coronavirus-latest-news-08-26-2020-11598427633    The Governor moves Louisiana to Phase 3 of Resilient Louisiana with effect from September 18th 2020:    https://web.archive.org/web/20200917234431/https://gov.louisiana.gov/assets/Proclamations/2020/123-JBE-2020-COVID-19-Public-Health-Emergency-Phase3-of-Resilient-LA.pdf,NA,NA,NA,NA,NA,NA,Aug 26 Gov extends phase two restrictions including closure of bars for two weeks in light of Hurricanes Marco and Laura  http://web.archive.org/web/20200903102439/https://www.wsj.com/articles/coronavirus-latest-news-08-26-2020-11598427633    The Governor moves Louisiana to Phase 3 of Resilient Louisiana with effect from September 18th 2020:    https://web.archive.org/web/20200917234431/https://gov.louisiana.gov/assets/Proclamations/2020/123-JBE-2020-COVID-19-Public-Health-Emergency-Phase3-of-Resilient-LA.pdf,NA,NA,NA,NA,NA,NA,NA,NA,NA,NA,NA,NA,NA,NA,NA,NA,NA,NA,NA
