State,2020-01-22,2020-01-23,2020-01-24,2020-01-25,2020-01-26,2020-01-27,2020-01-28,2020-01-29,2020-01-30,2020-01-31,2020-02-01,2020-02-02,2020-02-03,2020-02-04,2020-02-05,2020-02-06,2020-02-07,2020-02-08,2020-02-09,2020-02-10,2020-02-11,2020-02-12,2020-02-13,2020-02-14,2020-02-15,2020-02-16,2020-02-17,2020-02-18,2020-02-19,2020-02-20,2020-02-21,2020-02-22,2020-02-23,2020-02-24,2020-02-25,2020-02-26,2020-02-27,2020-02-28,2020-02-29,2020-03-01,2020-03-02,2020-03-03,2020-03-04,2020-03-05,2020-03-06,2020-03-07,2020-03-08,2020-03-09,2020-03-10,2020-03-11,2020-03-12,2020-03-13,2020-03-14,2020-03-15,2020-03-16,2020-03-17,2020-03-18,2020-03-19,2020-03-20,2020-03-21,2020-03-22,2020-03-23,2020-03-24,2020-03-25,2020-03-26,2020-03-27,2020-03-28,2020-03-29,2020-03-30,2020-03-31,2020-04-01,2020-04-02,2020-04-03,2020-04-04,2020-04-05,2020-04-06,2020-04-07,2020-04-08,2020-04-09,2020-04-10,2020-04-11,2020-04-12,2020-04-13,2020-04-14,2020-04-15,2020-04-16,2020-04-17,2020-04-18,2020-04-19,2020-04-20,2020-04-21,2020-04-22,2020-04-23,2020-04-24,2020-04-25,2020-04-26,2020-04-27,2020-04-28,2020-04-29,2020-04-30,2020-05-01,2020-05-02,2020-05-03,2020-05-04,2020-05-05,2020-05-06,2020-05-07,2020-05-08,2020-05-09,2020-05-10,2020-05-11,2020-05-12,2020-05-13,2020-05-14,2020-05-15,2020-05-16,2020-05-17,2020-05-18,2020-05-19,2020-05-20,2020-05-21,2020-05-22,2020-05-23,2020-05-24,2020-05-25,2020-05-26,2020-05-27,2020-05-28,2020-05-29,2020-05-30,2020-05-31,2020-06-01,2020-06-02,2020-06-03,2020-06-04,2020-06-05,2020-06-06,2020-06-07,2020-06-08,2020-06-09,2020-06-10,2020-06-11,2020-06-12,2020-06-13,2020-06-14,2020-06-15,2020-06-16,2020-06-17,2020-06-18,2020-06-19,2020-06-20,2020-06-21,2020-06-22,2020-06-23,2020-06-24,2020-06-25,2020-06-26,2020-06-27,2020-06-28,2020-06-29,2020-06-30,2020-07-01,2020-07-02,2020-07-03,2020-07-04,2020-07-05,2020-07-06,2020-07-07,2020-07-08,2020-07-09,2020-07-10,2020-07-11,2020-07-12,2020-07-13,2020-07-14,2020-07-15,2020-07-16,2020-07-17,2020-07-18,2020-07-19,2020-07-20,2020-07-21,2020-07-22,2020-07-23,2020-07-24,2020-07-25,2020-07-26,2020-07-27,2020-07-28,2020-07-29,2020-07-30,2020-07-31,2020-08-01,2020-08-02,2020-08-03,2020-08-04,2020-08-05,2020-08-06,2020-08-07,2020-08-08,2020-08-09,2020-08-10,2020-08-11,2020-08-12,2020-08-13,2020-08-14,2020-08-15,2020-08-16,2020-08-17,2020-08-18,2020-08-19,2020-08-20,2020-08-21,2020-08-22,2020-08-23,2020-08-24,2020-08-25,2020-08-26,2020-08-27,2020-08-28,2020-08-29,2020-08-30,2020-08-31,2020-09-01,2020-09-02,2020-09-03,2020-09-04,2020-09-05,2020-09-06,2020-09-07,2020-09-08,2020-09-09,2020-09-10,2020-09-11,2020-09-12,2020-09-13,2020-09-14,2020-09-15,2020-09-16,2020-09-17,2020-09-18,2020-09-19,2020-09-20,2020-09-21,2020-09-22,2020-09-23,2020-09-24,2020-09-25,2020-09-26,2020-09-27,2020-09-28,2020-09-29,2020-09-30,2020-10-01,2020-10-02,2020-10-03,2020-10-04,2020-10-05,2020-10-06,2020-10-07
Alabama,NA,NA,NA,NA,NA,NA,NA,NA,NA,NA,NA,NA,NA,NA,NA,NA,NA,NA,NA,NA,NA,NA,NA,NA,NA,NA,NA,NA,NA,NA,NA,NA,NA,NA,NA,NA,NA,NA,NA,NA,NA,NA,NA,NA,NA,NA,NA,NA,NA,NA,NA,NA,NA,NA,NA,NA,NA,NA,NA,NA,NA,NA,"On March 24, the City of Birmingham instituted a “shelter in place” ordinance in the form of a curfew that required all residents remain at home. Exceptions for essential trips and work or for daily exercise were permitted. The order was initially in effect through April 3, but was later extended through April 30.    https://web.archive.org/web/20200721193641/https://www.birminghamal.gov/2020/03/24/birmingham-city-council-approves-shelter-in-place-ordinance-to-slow-covid-19/    https://web.archive.org/web/20200721194103/https://www.birminghamal.gov/2020/03/25/frequently-asked-questions-about-birminghams-shelter-in-place-ordinance/    https://web.archive.org/web/20200721194547/https://www.birminghamal.gov/2020/04/03/city-of-birminghams-shelter-in-place-order-has-been-extended-to-april-30/",NA,NA,"On March 27, the city of Montgomery instituted a nightly curfew from 10 pm to 5 am requiring all persons to remain at home between those hours, except when providing essential services or making essential trips (such as to receive medical care or purchase food.)    https://web.archive.org/web/20200721194712/https:/www.montgomeryal.gov/Home/Components/News/News/1892/193",NA,NA,NA,NA,NA,NA,NA,"The State Health Officer issued a Statewide Order, effective Saturday, April 4, 2020, at 5:00 P.M., whereby ""every person is ordered to stay at his/her place of residence except as necessary to perform any essential activities”.   The Order expired on April 30, 2020.  (Essential services include obtaining or providing necessary supplies or services, attending religious service, taking care of others, essential work, etc.)      See Order of the State Health Officer:   http://archive.today/2020.08.04-144925/https://www.alabamapublichealth.gov/legal/assets/soe-covid19-040320.pdf    See detailed components listed down on the official governor's website:   http://archive.today/xVtVb",NA,NA,NA,NA,NA,NA,NA,NA,NA,NA,NA,NA,NA,NA,NA,NA,NA,NA,NA,NA,NA,NA,NA,NA,NA,"The State Health Officer announced a Safer at Home Order, superseding the Stay at Home Order. People were encouraged (and not ordered) to stay at home and follow good sanitation practices. The order was effective from April 30 to May 15, 2020.   See Safer at Home Order: Original Order: http://archive.fo/jWKhz Comparison with Stay at Home Order: http://archive.fo/S1dbv  On April 30, the City of Birmingham instituted a nightly curfew to replace its “Shelter in Place” ordinance. The curfew was in effect from 10 pm to 5 am until May 15. Residents were requried to remain in their homes except for essential purposes. 	This is coded as 1 because it only applies part of the time.  https://web.archive.org/web/20200721201116/https://www.birminghamal.gov/2020/05/05/frequently-asked-questions-on-the-city-of-birminghams-curfew-ordinance/",NA,NA,NA,NA,"People were encouraged (and not ordered) to stay at home and follow good sanitation practices. The order, which came into effect on April 30, is now extended to May 22, 2020.     See amended Safer at Home Order:  http://archive.today/eqmBT    See previous Order:  http://archive.fo/jWKhz",NA,NA,NA,NA,NA,NA,NA,NA,NA,NA,NA,NA,NA,NA,NA,"Under the Safer at Home Order, extended further until July 29, 2020 and then August 31, 2020 (refer to the amendments below), people are encouraged to stay at home and adopt a good hygiene/sanitation routine.    See the amended Safe at Home Order   (Amended 05/21/2020):   http://archive.fo/MhVep    (Amended 07/29/2020):   http://archive.today/LMsAH    See the Comparison Chart/Roadmap for the Stay at Home/Safer at Home Order: http://archive.fo/xVtVb",NA,NA,NA,NA,NA,NA,NA,NA,NA,NA,NA,NA,NA,NA,NA,NA,NA,NA,NA,NA,NA,NA,NA,NA,NA,NA,NA,NA,NA,"On June 20, the City of Montgomery’s nightly curfew was lifted, ending the stay-at-home requirement in place between 10 pm and 5 am. This policy was coded as 1 because it was only applicable between those hours.  https://web.archive.org/web/20200716004202/https://www.montgomeryal.gov/live/coronavirus",NA,NA,NA,NA,NA,NA,NA,NA,NA,NA,NA,NA,NA,NA,NA,NA,NA,NA,NA,NA,NA,NA,NA,NA,NA,NA,NA,NA,NA,NA,NA,NA,NA,NA,NA,NA,NA,NA,NA,NA,NA,NA,NA,NA,NA,NA,NA,NA,NA,NA,NA,NA,NA,NA,NA,NA,NA,NA,NA,NA,NA,NA,NA,NA,NA,NA,NA,"On August 27, Governor Ivey extended the ""Safer at Home"" order until October 2. No major changes were introduced. The recommendation that individuals stay at home continues.    https://web.archive.org/web/20200827201707/https://governor.alabama.gov/assets/2020/08/Safer-at-Home-Order-Final-8.27.20.pdf",NA,NA,NA,NA,NA,NA,NA,NA,NA,NA,NA,NA,NA,NA,NA,NA,NA,NA,NA,NA,NA,NA,NA,NA,NA,NA,NA,NA,NA,NA,NA,NA,"On Sept. 29, the Governor extended the “Safer at Home” order until November 8. No major changes were introduced. The state government continues to recommend individuals stay at home.    https://web.archive.org/web/20201001090822/https://governor.alabama.gov/assets/2020/09/Safer-at-Home-Order-Final-9.29.2020.pdf    https://web.archive.org/web/20201001091147/https://governor.alabama.gov/assets/2020/09/GKI-0040-2020-Health-Order-Update-Nov-8-Horizontal-2.pdf",NA,NA,NA,NA,NA,NA,NA,NA
Alaska,NA,NA,NA,NA,NA,NA,NA,NA,NA,NA,NA,NA,NA,NA,NA,NA,NA,NA,NA,NA,NA,NA,NA,NA,NA,NA,NA,NA,NA,NA,NA,NA,NA,NA,NA,NA,NA,NA,NA,NA,NA,NA,NA,NA,NA,NA,NA,NA,NA,NA,NA,NA,NA,NA,NA,NA,NA,NA,NA,NA,"On March 22nd, the mayor of Anchorage declared a ""hunker down"" order, ordering that people were to remain home, exceptions made (eg for grocery shopping and essential workers) until March 31st. See archive: https://web.archive.org/web/20200325102607/https://www.muni.org/departments/mayor/pressreleases/documents/eo-03.pdf",NA,"On March 24th, the Assembly of the City and Borough of Juneau passed a ""Hunker Down"" Order. See archive: https://web.archive.org/web/20200728111220/https://beta.juneau.org/index.php?gf-download=2020%2F03%2F2020-03-23_Notice_of_Adoption-with-signed-resolution-2885bam.pdf&form-id=22&field-id=11&hash=d553851e1ab5c2b8c255d28e494c9777e04a44faa5617afc3d41bb33d9902fe2",NA,NA,NA,"On March 28th, the governor of Alaska announced a stay-at-home order, except for essential workers and required travel. See archive: http://archive.today/2020.07.28-080809/https://gov.alaska.gov/wp-content/uploads/sites/2/03272020-SOA-COVID-19-Health-Mandate-011.pdf",NA,NA,NA,NA,NA,NA,NA,NA,NA,NA,NA,NA,NA,NA,NA,NA,NA,NA,NA,NA,NA,NA,NA,NA,NA,NA,"On April 24th, the governor of Alaska stated that the stay-at-home order was lifted. See archive: https://web.archive.org/web/20200430041322/https://gov.alaska.gov/wp-content/uploads/sites/2/0425-COVID-MANDATE-016-Attachment-N-Social-Religious-and-Other-Gatherings.pdf",NA,NA,NA,NA,NA,NA,NA,NA,NA,NA,NA,NA,NA,NA,NA,NA,NA,NA,NA,NA,NA,NA,NA,NA,NA,NA,NA,NA,NA,NA,NA,NA,NA,NA,NA,NA,NA,NA,NA,NA,NA,NA,NA,NA,NA,NA,NA,NA,NA,NA,NA,NA,NA,NA,NA,NA,NA,NA,NA,NA,NA,NA,NA,NA,NA,NA,NA,NA,NA,NA,NA,NA,NA,NA,NA,NA,NA,NA,NA,NA,NA,NA,NA,NA,NA,NA,NA,NA,NA,NA,NA,NA,NA,NA,NA,NA,NA,NA,NA,NA,"In Executive Order 15, Mayor Ethan Berkowitz of the Municipality of Anchorage ordered that effective 3 August 2020, everyone in the Municipality shall limit outings and physical contact with those outside of their household and a small chosen group of other individuals.    When individuals leave their home, they shall maintain physical distancing of at least 6 feet from any person outside their household/small group when possible. Masks are required to be worn in public.    Executive Order 15:  https://web.archive.org/web/20200806171937/https://www.muni.org/Departments/Mayor/PressReleases/Pages/Mayor-signs-Emergency-Orders-EO-15-and-EO-13-v2.aspx",NA,NA,NA,NA,NA,NA,NA,NA,NA,NA,NA,NA,NA,NA,NA,NA,"EO15 remains in effect in Anchorage until 30 August 2020.    Everyone in the Municipality is expected to continue to limit outings and physical contact with those outside of their household and a small chosen group of other individuals.    When individuals leave their home, they shall maintain physical distancing of at least 6 feet from any person outside their household/small group when possible. Masks are required to be worn in public.    Executive Order 15:  https://web.archive.org/web/20200806171937/https://www.muni.org/Departments/Mayor/PressReleases/Pages/Mayor-signs-Emergency-Orders-EO-15-and-EO-13-v2.aspx",NA,NA,NA,NA,NA,NA,NA,NA,NA,NA,"Anchorage's Mayor, Ethan Berkowitz, signed Emergency Order EO-14 v2, effective 31 August 2020.     - Individuals shall limit outings and contact with people outside of their household.  - At-risk individuals are recommended to take even greater precaution by staying at home and minimizing all in-person interactions.    https://web.archive.org/web/20200903181314/http://www.muni.org/Departments/Mayor/PressReleases/Pages/Mayor-issues-Emergency-Order-EO-14-v2.aspx",NA,NA,NA,NA,NA,NA,NA,NA,NA,Anchorage's Emergency Order EO-14 v2 remains in effect.,NA,NA,NA,NA,NA,NA,NA,Anchorage's Emergency Order EO-14 v2 remains in effect.,NA,NA,NA,NA,NA,NA,NA,NA,NA,NA,Anchorage's Emergency Order EO-14 v2 remains in effect.,NA,NA,NA,NA,NA,NA,NA,Anchorage's Emergency Order EO-14 v2 remains in effect.
Arizona,NA,NA,NA,NA,NA,NA,NA,NA,NA,NA,NA,NA,NA,NA,NA,NA,NA,NA,NA,NA,NA,NA,NA,NA,NA,NA,NA,NA,NA,NA,NA,NA,NA,NA,NA,NA,NA,NA,NA,NA,NA,NA,NA,NA,NA,NA,NA,NA,NA,NA,NA,NA,NA,NA,NA,NA,NA,NA,NA,NA,NA,NA,NA,NA,NA,NA,NA,NA,NA,"With EO2020-18, Gov. Ducey issues a stay-at-home order with broad exceptions, including procurement of groceries, but also leaving the home to go to work in workplaces not open to the public. Moreover, no documentation to prove nature of trips will be required.  https://web.archive.org/web/20200708032302/https://azgovernor.gov/file/34365/download?token=6YdWos-F https://web.archive.org/web/20200802145208/https://www.azcentral.com/story/opinion/op-ed/joannaallhands/2020/03/30/arizona-shelter-place-order-what-would-change/5090155002/",NA,NA,NA,NA,NA,NA,NA,NA,NA,NA,NA,NA,NA,NA,NA,NA,NA,NA,NA,NA,NA,NA,NA,NA,NA,NA,NA,NA,NA,"EO2020-33 extends stay-at-home order until May 15, but further loosens criteria for leaving the home (as more businesses open up such as hairdressers).  https://web.archive.org/web/20200502014509/https://azgovernor.gov/file/34712/download?token=aWa7Jw6L",NA,NA,NA,NA,NA,NA,NA,NA,NA,NA,NA,NA,NA,NA,NA,"On May 12, Gov. Ducey announced that the stay at home order would be lifted May 15. New EO2020-36 replaces previous orders and recommends vulnerable citizens and members of households that include vulnerable citizens to stay home as much as possible. https://web.archive.org/web/20200716072008/https://azgovernor.gov/file/34817/download?token=9X8aggcf",NA,NA,NA,NA,NA,NA,NA,NA,NA,NA,NA,NA,NA,NA,NA,NA,NA,NA,NA,NA,NA,NA,NA,NA,NA,NA,NA,NA,NA,NA,NA,NA,NA,NA,NA,NA,NA,NA,NA,NA,NA,NA,NA,NA,NA,NA,NA,NA,NA,NA,NA,NA,NA,NA,NA,NA,NA,NA,NA,NA,NA,NA,NA,NA,NA,NA,NA,NA,NA,NA,NA,NA,NA,NA,NA,NA,NA,NA,NA,NA,NA,NA,NA,NA,NA,NA,NA,NA,NA,NA,NA,NA,NA,NA,NA,NA,NA,NA,NA,NA,NA,NA,NA,NA,NA,NA,NA,NA,NA,NA,NA,NA,NA,NA,NA,NA,NA,NA,No new measures have been introduced. Previously noted policies remain valid.,NA,NA,NA,NA,No policy change noted.,NA,NA,NA,NA,NA,NA,NA,No mention of stay-at-home recommendations remains on the Arizona Department of Health Services website. They now only recommend staying at home only when sick or exposed.  https://web.archive.org/web/20200927045755/https://www.azdhs.gov/preparedness/epidemiology-disease-control/infectious-disease-epidemiology/index.php,NA,NA,NA,NA,NA,No policy change noted.,NA,NA,NA,NA,NA,NA
Arkansas,NA,NA,NA,NA,NA,NA,NA,NA,NA,NA,NA,NA,NA,NA,NA,NA,NA,NA,NA,NA,NA,NA,NA,NA,NA,NA,NA,NA,NA,NA,NA,NA,NA,NA,NA,NA,NA,NA,NA,NA,NA,NA,NA,NA,NA,NA,NA,NA,NA,NA,NA,"On 12 April 2020, the governor defended his decision to not impose or allow mayors of his state to impose stay-at-home orders. See CNN, archived: http://web.archive.org/web/20200714162221/https://edition.cnn.com/2020/04/12/politics/arkansas-governor-no-stay-at-home-order-coronavirus-cnntv/","On 12 April 2020, the governor defended his decision to not impose or allow mayors of his state to impose stay-at-home orders. See CNN, archived: http://web.archive.org/web/20200714162221/https://edition.cnn.com/2020/04/12/politics/arkansas-governor-no-stay-at-home-order-coronavirus-cnntv/","On 12 April 2020, the governor defended his decision to not impose or allow mayors of his state to impose stay-at-home orders. See CNN, archived: http://web.archive.org/web/20200714162221/https://edition.cnn.com/2020/04/12/politics/arkansas-governor-no-stay-at-home-order-coronavirus-cnntv/","On 12 April 2020, the governor defended his decision to not impose or allow mayors of his state to impose stay-at-home orders. See CNN, archived: http://web.archive.org/web/20200714162221/https://edition.cnn.com/2020/04/12/politics/arkansas-governor-no-stay-at-home-order-coronavirus-cnntv/","On 12 April 2020, the governor defended his decision to not impose or allow mayors of his state to impose stay-at-home orders. See CNN, archived: http://web.archive.org/web/20200714162221/https://edition.cnn.com/2020/04/12/politics/arkansas-governor-no-stay-at-home-order-coronavirus-cnntv/","On 12 April 2020, the governor defended his decision to not impose or allow mayors of his state to impose stay-at-home orders. See CNN, archived: http://web.archive.org/web/20200714162221/https://edition.cnn.com/2020/04/12/politics/arkansas-governor-no-stay-at-home-order-coronavirus-cnntv/","On 12 April 2020, the governor defended his decision to not impose or allow mayors of his state to impose stay-at-home orders. See CNN, archived: http://web.archive.org/web/20200714162221/https://edition.cnn.com/2020/04/12/politics/arkansas-governor-no-stay-at-home-order-coronavirus-cnntv/","On 12 April 2020, the governor defended his decision to not impose or allow mayors of his state to impose stay-at-home orders. See CNN, archived: http://web.archive.org/web/20200714162221/https://edition.cnn.com/2020/04/12/politics/arkansas-governor-no-stay-at-home-order-coronavirus-cnntv/","On 12 April 2020, the governor defended his decision to not impose or allow mayors of his state to impose stay-at-home orders. See CNN, archived: http://web.archive.org/web/20200714162221/https://edition.cnn.com/2020/04/12/politics/arkansas-governor-no-stay-at-home-order-coronavirus-cnntv/",NA,NA,NA,NA,NA,NA,NA,NA,NA,NA,NA,NA,NA,NA,NA,NA,NA,NA,NA,NA,NA,NA,NA,NA,NA,NA,NA,NA,NA,NA,NA,NA,NA,NA,NA,NA,NA,NA,NA,NA,NA,NA,NA,NA,NA,NA,NA,NA,NA,NA,NA,NA,NA,NA,NA,NA,NA,NA,NA,NA,NA,NA,NA,NA,NA,NA,NA,NA,NA,NA,NA,NA,NA,"According to Business Insider and other sources, Arkansas has never issued statewide stay-at-home orders.  http://archive.vn/AdbAd",NA,NA,NA,NA,NA,NA,NA,NA,NA,NA,NA,NA,NA,NA,NA,NA,NA,NA,NA,NA,NA,NA,NA,NA,NA,NA,NA,NA,NA,NA,NA,NA,NA,NA,NA,NA,NA,NA,NA,NA,NA,NA,NA,NA,NA,NA,NA,NA,NA,NA,NA,NA,NA,NA,NA,NA,NA,NA,NA,NA,NA,NA,NA,NA,NA,NA,NA,NA,NA,NA,NA,NA,NA,NA,NA,NA,NA,NA,NA,NA,NA,NA,NA,NA,NA,NA,NA,NA,NA,NA,NA,NA,NA,NA,NA,NA,NA,NA,NA,NA,NA,NA,NA,NA,NA,NA,NA,NA,NA,NA,NA,NA,NA,NA,NA,NA,NA,NA,NA,NA,NA,NA,NA,NA,NA,NA
