Montana,NA,NA,NA,NA,NA,NA,NA,NA,NA,NA,NA,NA,NA,NA,NA,NA,NA,NA,NA,NA,NA,NA,NA,NA,NA,NA,NA,NA,NA,NA,NA,NA,NA,NA,NA,NA,NA,NA,NA,NA,NA,NA,NA,NA,NA,NA,NA,NA,NA,NA,NA,NA,NA,NA,NA,NA,NA,NA,NA,NA,NA,NA,NA,NA,NA,"On March 27, the Confederated Salish and Kootenai Tribes are ordering everyone within their jurisdiction to stay in their homes except as needed to maintain critical necessities, effective immediately due to COVID-19 concerns. The order remains in effect immediately until further notice. The order includes a list of exceptions allowing people to continue their work and to maintain health and well-being on the Reservation. Residents will have access to necessities such as food, prescriptions, and health care. See KPAX news article link: https://web.archive.org/web/20200723203537/https://www.kpax.com/news/coronavirus/ckst-declares-shelter-in-place-order","The Governor has issued a directive that starting on March 28, all individuals currently living within the State of Montana are directed to stay at home or at their place of residence to the greatest extent possible. All persons may leave their homes or place of residence only for Essential Activities or to operate Essential Businesses and Operations. See Office of the Governor Link: https://web.archive.org/web/20200708051910/https://covid19.mt.gov/Portals/223/Documents/Stay%20at%20Home%20Directive.pdf?ver=2020-03-26-173332-177",NA,NA,NA,NA,NA,NA,NA,NA,NA,"On April 7, the Governor directed that the Stay at Home Directive effective on March 28 and all of its terms are extended through April 24, 2020. See Office of the Governor link: https://web.archive.org/web/20200708060234/https:/covid19.mt.gov/Portals/223/Documents/Extension%20of%20Directives.pdf?ver=2020-04-07-151254-310",NA,NA,NA,NA,NA,NA,NA,NA,NA,NA,NA,NA,NA,NA,NA,NA,NA,"While the state-wide stay at home order ended on April 24 as Montana starts re-opening with Phase 1, the Crow Tribe has extended their stay at home order until April 30. The stay at home order applies to all persons within the exterior boundaries of the Crow Indian Reservation. Residents can leave for only essential activities such as activities essential to their health and safety, to get necessary supplies, and for outdoor activities with proper social distancing.  See Facebook link:   https://web.archive.org/web/20200730212648/https://www.facebook.com/OfficialCTINews/photos/a.136225533561188/857735004743567",NA,NA,NA,NA,"The Crow Tribe has extended their stay at home order until May 14. The stay at home order applies to all persons within the exterior boundaries of the Crow Indian Reservation. Residents can leave for only essential activities such as activities essential to their health and safety, to get necessary supplies, and for outdoor activities with proper social distancing.   See Facebook link:  https://web.archive.org/web/20200730212530/https://www.facebook.com/OfficialCTINews/photos/pcb.863163104200757/863154880868246/",NA,NA,NA,NA,NA,NA,NA,NA,NA,NA,NA,NA,"The Crow Tribe has extended their stay at home order until June 15. The stay at home order applies to all persons within the exterior boundaries of the Crow Indian Reservation. Residents can leave for only essential activities such as activities essential to their health and safety, to get necessary supplies, and for outdoor activities with proper social distancing.   See Facebook link:   https://web.archive.org/web/20200730212327/https://www.facebook.com/OfficialCTINews/photos/pcb.872678559915878/872678396582561/",NA,NA,NA,NA,NA,NA,NA,NA,NA,NA,NA,NA,NA,NA,NA,NA,NA,NA,NA,NA,NA,NA,NA,NA,NA,NA,NA,NA,NA,NA,NA,NA,"The Crow Tribe has extended their stay at home order until July 15 as new cases are still appearing. The stay at home order applies to all persons within the exterior boundaries of the Crow Indian Reservation. Residents can leave for only essential activities such as activities essential to their health and safety, to get necessary supplies, and for outdoor activities with proper social distancing.   See Facebook link:   https://web.archive.org/web/20200730212144/https://www.facebook.com/OfficialCTINews/photos/pcb.896549444195456/904596710057396/",NA,NA,NA,NA,NA,NA,NA,NA,NA,NA,NA,NA,NA,NA,NA,NA,NA,NA,NA,NA,NA,NA,NA,NA,NA,NA,NA,NA,NA,NA,"The Crow Tribe has extended their stay at home order until August 31 for all persons within the exterior boundaries of the Crow Indian Reservation. Residents can leave for only essential activities such as activities essential to their health and safety, to get necessary supplies, and for outdoor activities with proper social distancing.     See Facebook announcement link: https://web.archive.org/web/20200730210534/https://www.facebook.com/OfficialCTINews/photos/pcb.918681165315617/918676641982736",NA,NA,NA,NA,NA,NA,NA,NA,NA,NA,NA,NA,NA,NA,NA,NA,NA,NA,NA,NA,"On August 6, the Crow Tribe modified their existing Stay at Home Order to a Lockdown until August 21, with only essential businesses and emergency and medical facilities allowed to remain open under specific guidelines.    All public gatherings will be banned for the time period and the use of Oka Beh’ Marina will be closed for the duration. Check points at access points to public areas and the reservation will be established to monitor and turn non-residents around.    After August 21, the order will revert back to the Stay at Home order until August 31.    See Crow Tribe Facebook announcement: https://web.archive.org/web/20200820195704/https://www.facebook.com/OfficialCTINews/photos/a.136225533561188/934386213745112",NA,NA,NA,NA,NA,NA,NA,NA,NA,NA,NA,NA,NA,NA,NA,NA,NA,NA,NA,NA,NA,"On August 28, the Crow Tribe was still under the Stay at Home order from the August 6 modified policy. August 6 note:  On August 6, the Crow Tribe modified their existing Stay at Home Order to a Lockdown until August 21, with only essential businesses and emergency and medical facilities allowed to remain open under specific guidelines.    All public gatherings will be banned for the time period and the use of Oka Beh’ Marina will be closed for the duration. Check points at access points to public areas and the reservation will be established to monitor and turn non-residents around.    After August 21, the order will revert back to the Stay at Home order until August 31.    See Crow Tribe Facebook announcement: https://web.archive.org/web/20200820195704/https://www.facebook.com/OfficialCTINews/photos/a.136225533561188/934386213745112",NA,NA,"On August 31, the Crow Tribe modified the stay at home order to include a curfew from 9:00pm-6:00am every day until September 14. Travel is also restricted to essential travel only. The Crow Tribe is also recommending that students that live on the reservation attend school by distance learning if possible.    See Crow Tribe announcement: https://web.archive.org/web/20200903191044/https://www.facebook.com/OfficialCTINews/photos/pcb.954267778423622/954264751757258",NA,NA,NA,NA,NA,NA,NA,NA,NA,NA,NA,NA,NA,"On September 14, the stay at home order for the Crow Tribe was lifted, and phase 1 of re-opening was announced due to declining COVID-19 case numbers. However, the curfew from 9pm to 6am daily stays in place, and gatherings of more than 50 people are still banned.    See Crow Tribe announcement: https://web.archive.org/web/20200917174155/https://www.facebook.com/photo.php?fbid=3458817394140484&set=gm.3360484924029038&type=3&theater=&ifg=1",NA,NA,NA,NA,NA,NA,NA,NA,NA,NA,NA,NA,NA,NA,NA,NA,NA,NA,NA,NA,"On Oct. 5 President Rynalea Whiteman Pena of the Northern Cheyenne tribe issued an executive order extending the full lockdown of the reservation.    Residents are advised to continue avoiding nonessential daytime travel during the week. Nonessential travel remains completely prohibited under the order during a weeknight curfew, from 6 P.M. to 6 A.M., and during the weekend at all hours.    The complete weekend lockdown begins 6 A.M. on Oct. 10 and ends 6 A.M., Oct. 12. The lockdown and curfew were put in place Sept. 23.    Tribal leadership said the current Stay At Home order will remain in place until there are 50 or fewer confirmed active coronavirus cases on the reservation for a full 30 days. The curfew and weekend lockdowns may also be extended until this goal is achieved. The order said the curfew will remain in place until public health officials recommend ending it.    See Montana Free Press article: https://web.archive.org/web/20201008050924/https://www.mtpr.org/post/northern-cheyenne-president-declares-continued-state-emergency-extends-restrictions",NA,NA
Nebraska,NA,NA,NA,NA,NA,NA,NA,NA,NA,NA,NA,NA,NA,NA,NA,NA,NA,NA,NA,NA,NA,NA,NA,NA,NA,NA,NA,NA,NA,NA,NA,NA,NA,NA,NA,NA,NA,NA,NA,NA,NA,NA,NA,NA,NA,NA,NA,NA,NA,NA,NA,NA,NA,NA,NA,NA,NA,NA,NA,NA,NA,NA,NA,NA,NA,NA,NA,NA,NA,NA,NA,NA,NA,NA,NA,NA,NA,NA,NA,"To help Nebraska stay focused on slowing the spread of the virus, the Governer designated April 10th – April 30th as “21 Days to Stay Home and Stay Healthy.”  As the virus starts to peak in our state, we need Nebraskans to be especially mindful about limiting its spread.  During this critical phase, we are asking everyone to follow six rules to keep Nebraska healthy:  1. Stay home.  No non-essential errands and no social gatherings.  Respect the ten-person limit.  2. Socially distance your work.  Work from home or use the six-foot rule as much as possible in the workplace.  3. Shop alone and only shop once a week.  Do not take family with you.  4. Help kids follow social distancing.  Play at home.  No group sports.  And no playgrounds.  5. Help seniors stay at home by shopping for them.  Do not visit long-term care facilities.  6. Exercise daily at home or with an appropriately socially-distanced activity.    As this is a recommendation and not an enforceable order, downgraded from 2G to 1G on review.  https://web.archive.org/web/20200730181609/https://governor.nebraska.gov/press/gov-ricketts-proclaims-“21-days-stay-home-and-stay-healthy”-unveils-six-rules-keep-nebraska  https://web.archive.org/web/20200816235252/https://governor.nebraska.gov/press/six-rules-keep-nebraska-healthy",NA,NA,NA,NA,NA,NA,NA,NA,NA,NA,NA,NA,NA,NA,NA,NA,NA,NA,NA,NA,"Throughout the month of May, we are reminding people to follow our Six Rules to Keep Nebraska Healthy:  ""1. Stay home.  Do not take unnecessary trips outside the home.  Respect the ten-person limit.""    https://governor.nebraska.gov/press/gov-ricketts-reviews-newest-directed-health-measures-proclaims-may-%25E2%2580%259Cbeef-month%25E2%2580%259D-nebraska (Waybackmachine unavailable)    http://archive.vn/8ImDD",NA,NA,NA,NA,NA,NA,NA,NA,NA,NA,NA,NA,NA,NA,NA,NA,NA,NA,NA,NA,NA,NA,NA,NA,NA,NA,NA,NA,NA,NA,"Following the 21-day ""stay at home initiative,"" downgraded to 0 again as neither Phase I nor Phase II guidance for reopening explicitly asks people to stay at home.",NA,NA,NA,NA,NA,NA,NA,NA,NA,NA,NA,NA,NA,NA,NA,NA,NA,NA,NA,NA,NA,NA,NA,NA,NA,NA,NA,NA,NA,NA,NA,NA,NA,NA,NA,NA,NA,NA,NA,NA,NA,NA,NA,NA,NA,NA,NA,NA,NA,NA,NA,NA,NA,NA,NA,NA,NA,NA,NA,NA,NA,NA,NA,NA,NA,NA,NA,NA,NA,NA,NA,NA,NA,NA,NA,NA,NA,NA,NA,NA,NA,NA,NA,NA,NA,NA,NA,NA,NA,NA,NA,NA,NA,NA,NA,NA,NA,NA,NA,NA,NA,NA,NA,NA,NA,NA,NA,NA,NA,NA,NA,NA,NA,NA,NA,NA,NA,NA,NA,NA,NA,NA,NA,NA,NA,NA,NA,NA
Nevada,NA,NA,NA,NA,NA,NA,NA,NA,NA,NA,NA,NA,NA,NA,NA,NA,NA,NA,NA,NA,NA,NA,NA,NA,NA,NA,NA,NA,NA,NA,NA,NA,NA,NA,NA,NA,NA,NA,NA,NA,NA,NA,NA,NA,NA,NA,NA,NA,NA,NA,NA,NA,NA,NA,NA,NA,NA,NA,"The government asks people to ""Stay Home for Nevada"", but it is not a directive.     http://web.archive.org/web/20200706130831/https://nvhealthresponse.nv.gov/wp-content/uploads/2020/03/SocialDistancing_3-20-2020-1.pdf",NA,NA,NA,NA,NA,NA,NA,NA,NA,NA,NA,"Governor Sisolak issues a formal ""stay at home"" directive applying to everyone except essential workers.    http://web.archive.org/web/20200706131333/https://nvhealthresponse.nv.gov/wp-content/uploads/2020/05/Governor-Sisolak-announces-Stay-at-Home-directive-extends-closure-date-to-the-end-of-April.pdf",NA,NA,NA,NA,NA,NA,NA,NA,NA,NA,NA,NA,NA,NA,NA,NA,NA,NA,NA,NA,NA,NA,NA,NA,NA,NA,NA,NA,NA,"Despite easing of restrictions on businesses, the ""stay at home"" directive is still extended to 15 May: ""Nevadans should stay at home except for necessary outings like going to work as an essential employee, buying groceries, picking up food or retail items from curbside pickup, or attending medical appointments.    http://web.archive.org/web/20200706132012/https://nvhealthresponse.nv.gov/wp-content/uploads/2020/05/Governor-Sisolak-Directive-016-Guidance-4-29-20.pdf",NA,NA,NA,NA,NA,NA,NA,"Nevada moves to ""Phase 1"" reopening on 9 May, individuals are still encouraged to stay home as much as possible.    http://web.archive.org/web/20200706132426/https://nvhealthresponse.nv.gov/wp-content/uploads/2020/05/Press-release-Phase-1-Reopening-Details.pdf",NA,NA,NA,NA,NA,NA,NA,NA,NA,NA,NA,NA,NA,NA,NA,NA,NA,NA,NA,"Under Phase 2 of the state re-opening, ""vulnerable populations should continue to shelter in place""    http://web.archive.org/web/20200706132622/https://nvhealthresponse.nv.gov/wp-content/uploads/2020/05/5.26-post-presser-release.pdf",NA,NA,NA,NA,NA,NA,NA,NA,NA,NA,NA,NA,NA,NA,NA,NA,NA,NA,NA,NA,NA,NA,NA,NA,NA,NA,NA,NA,NA,NA,The governor announces an extension of the current Phase 2 re-opening policies through to the end of July.    http://web.archive.org/web/20200706133449/https://nvhealthresponse.nv.gov/wp-content/uploads/2020/06/6.29-Phase-2-extension.pdf,NA,NA,NA,NA,NA,NA,NA,NA,NA,NA,NA,NA,NA,NA,NA,NA,NA,NA,NA,NA,NA,NA,NA,NA,NA,NA,NA,NA,NA,NA,NA,"The governor announced that all directives which were set to expire on July 31, 2020 shall remain in effect for the duration of the current state of emergency     http://archive.li/SeylY",NA,NA,NA,NA,NA,NA,NA,NA,NA,NA,NA,NA,NA,NA,Previous policy is continued,NA,NA,NA,NA,NA,NA,Previous policy continues,NA,NA,NA,NA,NA,Previous policy continues,NA,NA,NA,NA,NA,NA,NA,NA,NA,NA,NA,NA,NA,NA,NA,NA,NA,NA,NA,NA,NA,NA,NA,NA,NA,NA,NA,NA,NA,NA,NA,NA,The latest EO reopens all businesses and increases gathering sizes. There is no evidence of an active stay at home order or recommendation in Nevada. Minutes from the latest guidance uses 'stay-at-home' only in the context of anyone suspected of being infected. Thus the code is changed to a 0.    https://web.archive.org/web/20201001212734/https://nvhealthresponse.nv.gov/wp-content/uploads/2020/10/Declaration-of-Emergency-Directive-033.pdf    Minutes from latest guidance -   https://web.archive.org/web/20201001215525/https://nvhealthresponse.nv.gov/wp-content/uploads/2020/09/Nevada-Guidance-for-Safe-Gatherings-Celebrations-Ceremonies-and-Events.pdf,NA,NA,NA,NA,NA,NA,NA
New Hampshire,NA,NA,NA,NA,NA,NA,NA,NA,NA,NA,NA,NA,NA,NA,NA,NA,NA,NA,NA,NA,NA,NA,NA,NA,NA,NA,NA,NA,NA,NA,NA,NA,NA,NA,NA,NA,NA,NA,NA,NA,NA,NA,NA,NA,NA,NA,NA,NA,NA,NA,NA,NA,NA,NA,NA,NA,NA,NA,NA,NA,NA,NA,NA,NA,NA,"Citizens required to stay home; exceptions include exercise (at appropriate social distance), essential errands, visting a spouse, parent or child, going to work if an essential worker.     https://web.archive.org/web/20200716193211/https://www.governor.nh.gov/sites/g/files/ehbemt336/files/documents/emergency-order-17.pdf",NA,NA,NA,NA,NA,NA,NA,NA,NA,NA,NA,NA,NA,NA,NA,NA,NA,NA,NA,NA,NA,NA,NA,NA,NA,NA,NA,NA,NA,NA,NA,NA,NA,NA,NA,NA,NA,NA,NA,NA,NA,NA,NA,NA,NA,NA,NA,NA,NA,NA,NA,NA,NA,NA,NA,NA,NA,NA,NA,NA,NA,NA,NA,NA,NA,NA,NA,NA,NA,NA,NA,NA,NA,NA,NA,NA,NA,NA,NA,NA,"Stay at home order expires beginning on June 16th. A statewide reopening plan, ""Safer at home"" provides guidelines for businesses, tourists, and residents to transition safely away from required stay at home measures.      Final stay at home order: https://web.archive.org/web/20200716193516/https://www.governor.nh.gov/sites/g/files/ehbemt336/files/documents/emergency-order-49.pdf    Safer at home: https://web.archive.org/web/20200716194508/https://www.covidguidance.nh.gov/",NA,NA,NA,NA,NA,NA,NA,NA,NA,NA,NA,NA,NA,NA,NA,NA,NA,NA,NA,NA,NA,NA,NA,NA,NA,NA,NA,NA,NA,NA,NA,NA,NA,NA,NA,NA,NA,NA,NA,NA,NA,NA,NA,NA,NA,NA,NA,NA,NA,NA,NA,NA,NA,NA,NA,NA,NA,NA,NA,NA,NA,NA,NA,NA,NA,NA,NA,NA,NA,NA,NA,NA,NA,NA,NA,NA,NA,NA,NA,NA,NA,NA,NA,NA,NA,NA,NA,NA,NA,NA,NA,NA,NA,"""Safer at Home"" campaign: https://web.archive.org/web/20200924190438/https://www.covidguidance.nh.gov/",NA,NA,NA,NA,NA,NA,"""Safer at Home"" campaign: https://web.archive.org/web/20200924190438/https://www.covidguidance.nh.gov/",NA,NA,NA,NA,NA,NA,NA,NA,NA,NA,NA,NA
New Jersey,NA,NA,NA,NA,NA,NA,NA,NA,NA,NA,NA,NA,NA,NA,NA,NA,NA,NA,NA,NA,NA,NA,NA,NA,NA,NA,NA,NA,NA,NA,NA,NA,NA,NA,NA,NA,NA,NA,NA,NA,NA,NA,NA,NA,NA,NA,NA,NA,NA,NA,NA,NA,NA,NA,NA,NA,NA,NA,NA,"All NJ residents directed to stay at home unless they are ""obtaining essential goods or services, seeking medical attention, visiting family or close friends, reporting to work, or engaging in outdoor activities.""     https://web.archive.org/web/20200709185941/https://www.nj.gov/governor/news/news/562020/20200320j.shtml",NA,NA,NA,NA,NA,NA,NA,NA,NA,NA,NA,NA,NA,NA,NA,NA,NA,NA,NA,NA,NA,NA,NA,NA,NA,NA,NA,NA,NA,NA,NA,NA,NA,NA,NA,NA,NA,NA,NA,NA,NA,"Stay at home order remains in place, but state parks and golf courses are opened to allow for increased outdoor recreation.     https://web.archive.org/web/20200709191316/https://www.nj.gov/governor/news/news/562020/20200429c.shtml      Stay at home order beginning March 21:   All NJ residents directed to stay at home unless they are ""obtaining essential goods or services, seeking medical attention, visiting family or close friends, reporting to work, or engaging in outdoor activities.""     https://web.archive.org/web/20200709185941/https://www.nj.gov/governor/news/news/562020/20200320j.shtml",NA,NA,NA,NA,NA,NA,NA,NA,NA,NA,NA,NA,NA,NA,NA,NA,NA,NA,NA,NA,NA,NA,NA,NA,NA,NA,NA,NA,NA,NA,NA,NA,NA,NA,NA,NA,NA,"Governor Murphy lifts stay at home order but recommends responsible conduct:     ""Today, the stay at home order which has been in place since March 21 is being lifted. With more and more of our businesses reopening, we are no longer requiring you to stay at home, but we are asking you to continue to be responsible and safe. And when you do go out, please continue to wear face coverings and keep a social distance from others whenever possible.""    https://web.archive.org/web/20200709191920/https://nj.gov/governor/news/news/562020/approved/20200609b.shtml",NA,NA,NA,NA,NA,NA,NA,NA,NA,NA,NA,NA,NA,NA,NA,NA,NA,NA,NA,NA,NA,NA,NA,NA,NA,NA,NA,NA,NA,NA,NA,NA,NA,NA,NA,NA,NA,NA,NA,NA,NA,NA,NA,NA,NA,NA,NA,NA,NA,NA,NA,NA,"Effective August 1, Executive Order No. 171 orders and proclaims that the Public Health Emergency declared in Exec. Order No. 103 continues to exist throughout the state.   Link: https://web.archive.org/web/20200806225042/https://nj.gov/infobank/eo/056murphy/pdf/EO-171.pdf",NA,NA,NA,NA,NA,NA,NA,NA,NA,NA,NA,NA,NA,NA,NA,NA,NA,NA,NA,NA,NA,NA,NA,NA,NA,NA,NA,NA,NA,NA,NA,NA,NA,NA,NA,NA,NA,NA,NA,NA,NA,NA,NA,NA,NA,NA,NA,"""Precautions that apply across all stages include:    Work that can be done from home should continue to be done from home.  Clinically high-risk individuals who can stay at home should continue to do so.  All residents and businesses should follow state and federal safeguarding guidelines: wash hands; wear masks in public; respect social distancing; minimize gatherings; disinfect workplace and businesses; and no mass gatherings""    https://web.archive.org/web/20200911085110/https://covid19.nj.gov/faqs/nj-information/reopening-guidance-and-restrictions/when-and-how-is-new-jersey-lifting-restrictions-what-does-a-responsible-and-strategic-restart-of-new-jerseys-economy-look-like",NA,NA,NA,NA,NA,NA,"""Precautions that apply across all stages include:    Work that can be done from home should continue to be done from home.  Clinically high-risk individuals who can stay at home should continue to do so.  All residents and businesses should follow state and federal safeguarding guidelines: wash hands; wear masks in public; respect social distancing; minimize gatherings; disinfect workplace and businesses; and no mass gatherings""    https://web.archive.org/web/20200911085110/https://covid19.nj.gov/faqs/nj-information/reopening-guidance-and-restrictions/when-and-how-is-new-jersey-lifting-restrictions-what-does-a-responsible-and-strategic-restart-of-new-jerseys-economy-look-like",NA,NA,NA,NA,NA,NA,NA,NA,NA,NA,NA,NA
New Mexico,NA,NA,NA,NA,NA,NA,NA,NA,NA,NA,NA,NA,NA,NA,NA,NA,NA,NA,NA,NA,NA,NA,NA,NA,NA,NA,NA,NA,NA,NA,NA,NA,NA,NA,NA,NA,NA,NA,NA,NA,NA,NA,NA,NA,NA,NA,NA,NA,NA,NA,NA,NA,NA,NA,"In the Public Health Emergency Order issued on March 16, Kathyleen M Kunkel, Cabinet Secretary of the New Mexico Department of Health states ""I further advise the public to take the following preventative precautions: New Mexico citizens are strongly advised to stay at home and undertake only those outings absolutely necessary for their health, safety or welfare.""     Update on city-level policies:   The New Mexico Department of Health's advice that New Mexico citizens stay home is more stringent than policies set out in the emergency declarations of the two biggest cities in New Mexico, Santa Fe and Albuquerque.     Santa Fe: In the second proclamation of emergency issued on March 23, Mayor Alan Webber echos the state recommendation, encouraging "" all residents should stay at home, with the exception of essential trips such as going to buy food, getting medical prescriptions filled and supplies purchased, and to attend to other essential business"".       Albuquerque: On April 10, Mayor Tim Keller (Albuquerque) signs a declaration that references the state guidance to stay at home, but provides no further guidance.     Public Health Emergency Order - March 16:   http://web.archive.org/web/20200419094446/https://cv.nmhealth.org/wp-content/uploads/2020/03/031620-DOH-PHO-r.pdf    Santa Fe - March 23:   http://web.archive.org/web/20200803125001/https://www.santafenm.gov/news/detail/proclamation_of_emergency_ii_-_covid_-_19_3232020    Albuquerque - April 10:   http://web.archive.org/web/20200803125338/https://www.cabq.gov/clerk/documents/declaration-order-april-10.pdf",NA,NA,NA,NA,NA,NA,NA,NA,NA,NA,NA,NA,NA,NA,NA,NA,NA,NA,NA,NA,NA,NA,NA,NA,NA,NA,NA,NA,NA,NA,NA,NA,NA,NA,NA,NA,NA,NA,NA,NA,NA,NA,NA,NA,NA,NA,NA,NA,NA,NA,NA,NA,NA,NA,NA,NA,NA,NA,NA,"Public Health Order on May 15 reiterates advice that ""all New Mexicans should be staying in their homes for all but the most essential activities and services"". This note appears on Public Health Orders from March 16 onward - see note on March 16 for more details     Public Health Order - May 15:   http://web.archive.org/web/20200630161411/https://cv.nmhealth.org/wp-content/uploads/2020/05/5-15-2020-PHO.pdf",NA,NA,NA,NA,NA,NA,NA,NA,NA,NA,NA,NA,NA,NA,NA,NA,NA,NA,NA,NA,NA,NA,NA,NA,NA,NA,NA,NA,NA,NA,NA,NA,NA,NA,NA,NA,NA,NA,NA,NA,NA,NA,NA,NA,NA,"Public Health Order on June 30 again reiterates advice that ""all New Mexicans should be staying in their homes for all but the most essential activities and services"". This note appears on Public Health Orders from March 16 onward - see note on March 16 for more details     Public Health Order - June 30:   http://web.archive.org/web/20200702052355/https://cv.nmhealth.org/wp-content/uploads/2020/07/063020-PHO-1.pdf",NA,NA,NA,NA,NA,NA,NA,NA,NA,NA,NA,NA,"Public Health Order on July 30 reiterates advice that ""all New Mexicans should be staying in their homes for all but the most essential activities and services"". This note appears on Public Health Orders from March 16 onward - see note on March 16 for more details     Public Health Order - July 13:   http://web.archive.org/web/20200719145207/https://cv.nmhealth.org/wp-content/uploads/2020/07/7.13.20-PHO-1.pdf",NA,NA,NA,NA,NA,NA,NA,NA,NA,NA,NA,NA,NA,NA,NA,NA,NA,NA,NA,NA,NA,NA,NA,NA,NA,NA,NA,NA,NA,NA,NA,NA,NA,NA,NA,NA,NA,NA,NA,NA,NA,NA,NA,NA,NA,NA,"On August 29, Gov. Michelle Lujan Grisham and the State Department of Health reissued and revised the Emergency Public Health Order. Restrictions largely remained intact, and the recommendation that all New Mexicans remain at home except for essential purposes is preserved. The order expires September 18.     https://web.archive.org/web/20200903213200/https://www.nmhealth.org/news/alert/2020/8/?view=1114    https://web.archive.org/web/20200830103040/https://cv.nmhealth.org/wp-content/uploads/2020/08/082820-PHO.pdf",NA,NA,NA,NA,"On Sept 3, the Public Health Emergency Order was revised with restrictions largely intact and unchanged from Aug 29. The recommendation that all New Mexicans remain at home except for essential purposes is stated again in this order.     Link to Public Health Emergency Order:   https://archive.fo/zofLq",NA,NA,NA,NA,NA,NA,NA,NA,NA,NA,NA,NA,NA,NA,"On Sept 18, an updated Public Health Emergency Order was issued which maintained the recommendation that all New Mexicans remain at home except for essential purposes.     Link to Public Health Order on Sept 18:   https://archive.fo/XublU",NA,NA,NA,NA,NA,NA,NA,NA,NA,NA,NA,NA,NA,NA,NA,NA,NA,NA,NA
